name,datetime,tempmax,tempmin,temp,feelslikemax,feelslikemin,feelslike,dew,humidity,precip,precipprob,precipcover,preciptype,snow,snowdepth,windgust,windspeed,winddir,sealevelpressure,cloudcover,visibility,solarradiation,solarenergy,uvindex,severerisk,sunrise,sunset,moonphase,conditions,description,icon,stations
sumenep,1/1/2023,29.9,24.2,26.5,34.8,24.2,27.8,24.2,87.4,78,100,12.5,rain,0,0,60.8,38.2,292.4,1010.1,96.1,15.7,174.6,15,6,30,2023-01-01T05:12:18,2023-01-01T17:43:33,0.3,"Rain, Overcast",Cloudy skies throughout the day with rain clearing later.,rain,"96937099999,96973099999,remote"
sumenep,1/2/2023,31,26,27.3,38.1,26,30,24.4,84.4,4,100,12.5,rain,0,0,62.6,40.5,291.4,1009,91,18.6,211.2,18.3,8,60,2023-01-02T05:12:49,2023-01-02T17:43:58,0.34,"Rain, Overcast",Cloudy skies throughout the day with rain clearing later.,rain,"96937099999,96973099999,remote"
sumenep,1/3/2023,32.7,26.2,27.9,40.3,26.2,31,24.2,80.7,1.2,100,37.5,rain,0,0,56.9,36,291.9,1008.7,93.8,19.1,275.4,23.9,9,30,2023-01-03T05:13:20,2023-01-03T17:44:23,0.37,"Rain, Overcast",Cloudy skies throughout the day with a chance of rain throughout the day.,rain,"96937099999,96973099999,remote"
sumenep,1/4/2023,32.9,26.5,28.3,39.9,26.5,31.9,24.2,79,2,100,41.67,rain,0,0,57.6,46.4,288.7,1008.4,70.7,17.1,263.6,22.8,9,60,2023-01-04T05:13:51,2023-01-04T17:44:46,0.41,"Rain, Partially cloudy",Partly cloudy throughout the day with a chance of rain throughout the day.,rain,"96937099999,96973099999,remote"
sumenep,1/5/2023,32.7,26.3,28.4,39.9,26.3,32.2,24.2,78.3,11.2,100,8.33,rain,0,0,41.4,27.7,275.4,1009.2,79.5,18.6,281,24.4,10,30,2023-01-05T05:14:22,2023-01-05T17:45:10,0.44,"Rain, Partially cloudy",Partly cloudy throughout the day with late afternoon rain.,rain,"96937099999,96973099999,remote"
sumenep,1/6/2023,31.5,25.4,28,38,25.4,31.6,24.3,80.8,1.9,100,25,rain,0,0,38.5,19.1,262.6,1009.5,86,17.3,247.7,21.5,9,30,2023-01-06T05:14:53,2023-01-06T17:45:32,0.47,"Rain, Partially cloudy",Partly cloudy throughout the day with rain.,rain,"96937099999,96973099999,remote"
sumenep,1/7/2023,32.1,25.6,28.2,39,25.6,31.9,24.1,78.9,0.6,100,12.5,rain,0,0,24.5,14.8,267.4,1008.7,77.4,18,283,24.4,9,30,2023-01-07T05:15:23,2023-01-07T17:45:54,0.5,"Rain, Partially cloudy",Partly cloudy throughout the day with rain.,rain,"96937099999,96973099999,remote"
sumenep,1/8/2023,31.6,25.4,27.5,37.3,25.4,29.8,24.3,83.6,2.2,100,50,rain,0,0,21.6,9.4,259.5,1009.9,71.4,17.6,267.5,23.1,9,30,2023-01-08T05:15:54,2023-01-08T17:46:15,0.54,"Rain, Partially cloudy",Partly cloudy throughout the day with a chance of rain throughout the day.,rain,"96937099999,96973099999,remote"
sumenep,1/9/2023,32.4,24.9,27.4,40.6,24.9,29.9,24.2,83.4,1,100,4.17,rain,0,0,21.2,20.8,261.8,1011.4,80.4,17.9,272.9,23.7,9,30,2023-01-09T05:16:24,2023-01-09T17:46:35,0.58,"Rain, Partially cloudy",Partly cloudy throughout the day with late afternoon rain.,rain,"96937099999,96973099999,remote"
sumenep,1/10/2023,31.9,25.6,27.8,39.5,25.6,30.7,24.2,81.3,1.4,100,41.67,rain,0,0,19.1,9.4,259.6,1010.9,65.4,19.4,286.3,24.7,9,30,2023-01-10T05:16:54,2023-01-10T17:46:55,0.61,"Rain, Partially cloudy",Partly cloudy throughout the day with rain.,rain,"96937099999,96973099999,remote"
sumenep,1/11/2023,32.5,25.8,28.2,38.7,25.8,31.4,24.2,79.3,0.4,100,16.67,rain,0,0,15.8,12.2,91.3,1010.1,63.3,18.8,277.4,24,10,30,2023-01-11T05:17:23,2023-01-11T17:47:14,0.64,"Rain, Partially cloudy",Partly cloudy throughout the day with rain clearing later.,rain,"96937099999,96973099999,remote"
sumenep,1/12/2023,31.5,25.9,27.7,38.4,25.9,30.3,24.1,81.2,1.5,100,41.67,rain,0,0,21.2,13,333.2,1009.9,67.1,16.8,271.3,23.4,9,30,2023-01-12T05:17:52,2023-01-12T17:47:31,0.68,"Rain, Partially cloudy",Partly cloudy throughout the day with a chance of rain throughout the day.,rain,"96937099999,96973099999,remote"
sumenep,1/13/2023,31.1,24.6,27.4,37.6,24.6,29.7,23.9,81.5,5.1,100,8.33,rain,0,0,19.8,27.9,306.8,1009.6,59.3,18.7,293.6,25.4,10,30,2023-01-13T05:18:21,2023-01-13T17:47:49,0.71,"Rain, Partially cloudy",Partly cloudy throughout the day with rain.,rain,"96937099999,96973099999,remote"
sumenep,1/14/2023,32.1,24.9,28,39,24.9,31.2,24.1,79.5,18,100,8.33,rain,0,0,35.3,25.9,287.9,1008.2,64.9,18.4,296,25.7,9,30,2023-01-14T05:18:50,2023-01-14T17:48:05,0.74,"Rain, Partially cloudy",Partly cloudy throughout the day with afternoon rain.,rain,"96937099999,96973099999,remote"
sumenep,1/15/2023,33.3,25.9,28.4,40.4,25.9,32.2,24.6,80.9,5.4,100,66.67,rain,0,0,38.2,22.3,296.9,1007.5,80.2,16.6,280.1,24.2,10,60,2023-01-15T05:19:18,2023-01-15T17:48:20,0.75,"Rain, Partially cloudy",Partly cloudy throughout the day with a chance of rain throughout the day.,rain,"96937099999,96973099999,remote"
sumenep,1/16/2023,31.7,26,27.8,37.5,26,31,24.6,83,7,100,4.17,rain,0,0,43.2,26.3,293.4,1008.4,91.7,18.8,242.4,20.9,9,60,2023-01-16T05:19:45,2023-01-16T17:48:35,0.81,"Rain, Overcast",Cloudy skies throughout the day with morning rain.,rain,"96937099999,96973099999,remote"
sumenep,1/17/2023,32.7,25.7,27.6,40.2,25.7,30.3,24.4,83.2,6.8,100,58.33,rain,0,0,33.5,22.3,281.9,1009.6,88.5,19.3,214.1,18.6,9,60,2023-01-17T05:20:13,2023-01-17T17:48:48,0.84,"Rain, Partially cloudy",Partly cloudy throughout the day with a chance of rain throughout the day.,rain,"96937099999,96973099999,remote"
sumenep,1/18/2023,31.7,25.1,26.8,38.4,25.1,28.8,24,84.6,13.7,100,66.67,rain,0,0,28.1,23.7,286.8,1009.8,89.3,16.2,141.1,12.1,6,30,2023-01-18T05:20:39,2023-01-18T17:49:01,0.88,"Rain, Partially cloudy",Partly cloudy throughout the day with a chance of rain throughout the day.,rain,"96937099999,96973099999,remote"
sumenep,1/19/2023,30.9,24.9,27,36.9,24.9,29,23.9,83.7,22,100,4.17,rain,0,0,34.9,22.3,286.2,1009.5,93.7,16.9,109.6,9.3,5,30,2023-01-19T05:21:06,2023-01-19T17:49:13,0.91,"Rain, Overcast",Cloudy skies throughout the day with afternoon rain.,rain,"96937099999,96973099999,remote"
sumenep,1/20/2023,30.4,25.8,27.1,36.9,25.8,29.1,24.3,84.9,3.2,100,8.33,rain,0,0,22.3,13,262.7,1009.1,92.7,16.6,242,20.7,9,30,2023-01-20T05:21:31,2023-01-20T17:49:24,0.94,"Rain, Overcast",Cloudy skies throughout the day with afternoon rain.,rain,"96937099999,96973099999,remote"
sumenep,1/21/2023,30.4,24.9,27.2,37.2,24.9,29.2,24.1,84,0.1,100,4.17,rain,0,0,16.2,7.6,278.5,1008.1,85,16.2,253.8,22,9,30,2023-01-21T05:21:56,2023-01-21T17:49:34,0.98,"Rain, Partially cloudy",Partly cloudy throughout the day with afternoon rain.,rain,"96937099999,96973099999,remote"
sumenep,1/22/2023,30.4,25.5,27.3,37.2,25.5,29.8,24.5,84.7,8,100,4.17,rain,0,0,20.9,13,268.8,1007.1,87,15.7,272.5,23.5,9,30,2023-01-22T05:22:21,2023-01-22T17:49:43,0,"Rain, Partially cloudy",Partly cloudy throughout the day with afternoon rain.,rain,"96937099999,96973099999,remote"
sumenep,1/23/2023,32.1,25.3,27.6,39.3,25.3,30.5,24.4,83.3,18,100,12.5,rain,0,0,19.8,16.6,267.8,1006.4,84.6,16.4,227.7,19.7,9,30,2023-01-23T05:22:45,2023-01-23T17:49:51,0.04,"Rain, Partially cloudy",Partly cloudy throughout the day with rain.,rain,"96937099999,96973099999,remote"
sumenep,1/24/2023,31.6,25.9,27.7,39.8,25.9,30.5,24.5,82.9,0.5,100,4.17,rain,0,0,20.9,12.2,284.5,1006.4,82.1,15.2,266.9,23.2,9,30,2023-01-24T05:23:08,2023-01-24T17:49:58,0.08,"Rain, Partially cloudy",Partly cloudy throughout the day with late afternoon rain.,rain,"96937099999,96973099999,remote"
sumenep,1/25/2023,31.2,25.2,27.2,37.6,25.2,29.2,24.5,85.8,30,100,8.33,rain,0,0,30.6,21.2,291.4,1006.7,94.1,15,227.3,19.6,8,30,2023-01-25T05:23:31,2023-01-25T17:50:04,0.11,"Rain, Overcast",Cloudy skies throughout the day with rain.,rain,"96937099999,96973099999,remote"
sumenep,1/26/2023,29,25.2,26.8,34.6,25.2,28.6,24.3,86.3,0.7,100,8.33,rain,0,0,24.5,14.4,278.9,1007,93.7,14.9,200.8,17.4,7,30,2023-01-26T05:23:53,2023-01-26T17:50:09,0.15,"Rain, Overcast",Cloudy skies throughout the day with late afternoon rain.,rain,"96937099999,96973099999,remote"
sumenep,1/27/2023,31,24.9,26.7,37.1,24.9,28.2,24,85.4,0.4,100,4.17,rain,0,0,29.5,20.5,278.9,1006.8,94.2,17.5,104.8,9,4,30,2023-01-27T05:24:15,2023-01-27T17:50:13,0.18,"Rain, Overcast",Cloudy skies throughout the day with late afternoon rain.,rain,"96937099999,96973099999,remote"
sumenep,1/28/2023,29.1,24.7,26.3,34.3,24.7,27.1,24,87.2,1.2,100,8.33,rain,0,0,34.9,31.7,280.4,1006.8,99,13.1,92.7,8,4,10,2023-01-28T05:24:36,2023-01-28T17:50:17,0.25,"Rain, Overcast",Cloudy skies throughout the day with early morning rain.,rain,"96937099999,96973099999,remote"
sumenep,1/29/2023,30.9,24.9,27.1,37.7,24.9,29.1,24.2,84.6,7,100,4.17,rain,0,0,36,25.8,272.6,1007.4,95.1,18.3,175.9,15.2,7,30,2023-01-29T05:24:56,2023-01-29T17:50:19,0.25,"Rain, Overcast",Cloudy skies throughout the day with afternoon rain.,rain,"96937099999,96973099999,remote"
sumenep,1/30/2023,30.9,25.3,27.7,39.4,25.3,30.6,24.4,82.5,2.1,100,29.17,rain,0,0,39.6,25.9,272.1,1008.3,94.6,17.6,234,20,9,30,2023-01-30T05:25:15,2023-01-30T17:50:20,0.28,"Rain, Overcast",Cloudy skies throughout the day with rain.,rain,"96937099999,96973099999,remote"
sumenep,1/31/2023,30.4,25.9,27.6,37.8,25.9,30.2,24.6,84.3,26,100,4.17,rain,0,0,27.4,20.5,287.1,1007.5,94.1,16.6,268.3,23.1,8,60,2023-01-31T05:25:34,2023-01-31T17:50:21,0.31,"Rain, Overcast",Cloudy skies throughout the day with afternoon rain.,rain,"96937099999,96973099999,remote"
sumenep,2/1/2023,29.8,25.1,27.2,36.3,25.1,29.5,24.3,84.3,11.5,100,8.33,rain,0,0,37.1,23.4,280,1007.4,97.5,17.4,244.5,21.1,9,30,2023-02-01T05:25:53,2023-02-01T17:50:20,0.35,"Rain, Overcast",Cloudy skies throughout the day with rain.,rain,"96937099999,96973099999,remote"
sumenep,2/2/2023,28.9,25.1,26.3,35.2,25.1,27.3,24.4,89.3,1.5,100,8.33,rain,0,0,34.9,20.9,283.2,1008.9,99,15.6,101.4,8.8,4,10,2023-02-02T05:26:10,2023-02-02T17:50:18,0.38,"Rain, Overcast",Cloudy skies throughout the day with early morning rain.,rain,"96937099999,96973099999,remote"
sumenep,2/3/2023,29.9,24.9,27.1,36,24.9,29.7,24.2,84.4,99,100,4.17,rain,0,0,41,24.1,280.8,1007.8,97.9,19.7,172,14.7,7,30,2023-02-03T05:26:27,2023-02-03T17:50:16,0.41,"Rain, Overcast",Cloudy skies throughout the day with morning rain.,rain,"96937099999,96973099999,remote"
sumenep,2/4/2023,29.9,26.1,27.4,36,26.1,30,24.2,82.7,2.1,100,45.83,rain,0,0,43.2,28.1,297.6,1007.2,95,14.1,221.6,19.1,9,30,2023-02-04T05:26:43,2023-02-04T17:50:12,0.45,"Rain, Overcast",Cloudy skies throughout the day with a chance of rain throughout the day.,rain,"96937099999,96973099999,remote"
sumenep,2/5/2023,30.5,25.7,27.5,38.6,25.7,30.1,24.4,83.6,31.2,100,8.33,rain,0,0,39.6,23,287.6,1007.1,99.4,15.8,129.5,11.3,4,30,2023-02-05T05:26:59,2023-02-05T17:50:08,0.48,"Rain, Overcast",Cloudy skies throughout the day with rain.,rain,"96937099999,96973099999,remote"
sumenep,2/6/2023,30.2,24.1,27.5,37.2,24.1,30.2,24.2,82.8,0.4,100,4.17,rain,0,0,37.1,30.8,288.7,1007.3,95.5,17.7,223,19.3,8,30,2023-02-06T05:27:13,2023-02-06T17:50:03,0.5,"Rain, Overcast",Cloudy skies throughout the day with early morning rain.,rain,"96937099999,96973099999,remote"
sumenep,2/7/2023,29.9,25.3,27.3,35.8,25.3,30.1,24.3,83.8,3,100,4.17,rain,0,0,43.9,42.5,298.1,1007.7,92.5,16.3,210,18.2,9,30,2023-02-07T05:27:27,2023-02-07T17:49:56,0.55,"Rain, Overcast",Cloudy skies throughout the day with morning rain.,rain,"96937099999,96973099999,remote"
sumenep,2/8/2023,29.1,25.3,26.9,34.1,25.3,29,24.4,86.5,14.4,100,54.17,rain,0,0,37.1,44.6,295.2,1008.3,86.7,17.9,89.6,7.8,4,30,2023-02-08T05:27:41,2023-02-08T17:49:49,0.58,"Rain, Partially cloudy",Partly cloudy throughout the day with a chance of rain throughout the day.,rain,"96937099999,96973099999,remote"
sumenep,2/9/2023,30.7,24.5,27.4,36.8,24.5,29.9,24.5,84.5,3,100,4.17,rain,0,0,36.7,23,297.1,1008.1,86.8,16.7,267.6,23.3,9,60,2023-02-09T05:27:53,2023-02-09T17:49:41,0.62,"Rain, Partially cloudy",Partly cloudy throughout the day with late afternoon rain.,rain,"96937099999,96973099999,remote"
sumenep,2/10/2023,30,24.6,27,37.1,24.6,29.7,24.5,86.7,8.5,100,66.67,rain,0,0,36.4,23.8,294.7,1007.8,94.5,18.4,149.7,12.9,5,60,2023-02-10T05:28:05,2023-02-10T17:49:32,0.65,"Rain, Overcast",Cloudy skies throughout the day with a chance of rain throughout the day.,rain,"96937099999,96973099999,remote"
sumenep,2/11/2023,30.3,25.8,27.2,36,25.8,29.7,24.5,85.3,7.7,100,54.17,rain,0,0,42.8,22.7,289.3,1008.9,89.9,17.8,236.8,20.4,8,30,2023-02-11T05:28:16,2023-02-11T17:49:22,0.69,"Rain, Partially cloudy",Partly cloudy throughout the day with a chance of rain throughout the day.,rain,"96937099999,96973099999,remote"
sumenep,2/12/2023,31.2,25.4,27,38,25.4,29,24.2,84.8,22,100,12.5,rain,0,0,40.7,22.7,276.6,1009.7,98,16.5,200,17.3,7,30,2023-02-12T05:28:27,2023-02-12T17:49:12,0.72,"Rain, Overcast",Cloudy skies throughout the day with rain.,rain,"96937099999,96973099999,remote"
sumenep,2/13/2023,30.2,25,26.8,36.6,25,28.5,24.2,85.7,4,100,8.33,rain,0,0,30.6,17.6,282.5,1009.1,96,17.5,208.8,18.1,8,30,2023-02-13T05:28:37,2023-02-13T17:49:00,0.75,"Rain, Overcast",Cloudy skies throughout the day with rain.,rain,"96937099999,96973099999,remote"
sumenep,2/14/2023,30.4,25.1,27.2,36.3,25.1,29.2,24.1,83.5,3.5,100,50,rain,0,0,40.3,25.2,285,1007.5,95.2,17.4,257.2,22.3,9,30,2023-02-14T05:28:46,2023-02-14T17:48:48,0.79,"Rain, Overcast",Cloudy skies throughout the day with a chance of rain throughout the day.,rain,"96937099999,96973099999,remote"
sumenep,2/15/2023,30.7,25.2,26.4,37.9,25.2,27.5,24.1,86.9,15.1,100,8.33,rain,0,0,37.1,23.4,288.2,1007.7,88.3,15.8,200,17.3,7,30,2023-02-15T05:28:55,2023-02-15T17:48:34,0.82,"Rain, Partially cloudy",Partly cloudy throughout the day with rain.,rain,"96937099999,96973099999,remote"
sumenep,2/16/2023,30.1,24.9,26.4,37.1,24.9,27.5,24.2,87.8,13,100,8.33,rain,0,0,37.4,20.9,274.3,1008.9,96.1,16.3,103.7,9.1,5,30,2023-02-16T05:29:03,2023-02-16T17:48:20,0.86,"Rain, Overcast",Cloudy skies throughout the day with rain.,rain,"96937099999,96973099999,remote"
sumenep,2/17/2023,31.3,24.7,27.2,39.3,24.7,29.8,24.4,84.9,4,100,54.17,rain,0,0,42.5,27.4,285.6,1008.6,89,17.4,234.5,20.4,8,30,2023-02-17T05:29:10,2023-02-17T17:48:06,0.89,"Rain, Partially cloudy",Partly cloudy throughout the day with a chance of rain throughout the day.,rain,"96937099999,96973099999,remote"
sumenep,2/18/2023,31.7,25.7,27.3,38.9,25.7,29.5,24.4,84.4,31,100,12.5,rain,0,0,36.7,23,283.9,1008.5,80.7,16.9,222.2,19,7,30,2023-02-18T05:29:16,2023-02-18T17:47:50,0.93,"Rain, Partially cloudy",Partly cloudy throughout the day with rain.,rain,"96937099999,96973099999,remote"
sumenep,2/19/2023,31.4,25.1,27.2,39.9,25.1,29.5,24.5,85.4,41,100,4.17,rain,0,0,35.3,29.5,274.8,1008.8,69.4,15.2,236.8,20.2,8,60,2023-02-19T05:29:22,2023-02-19T17:47:34,0.96,"Rain, Partially cloudy",Partly cloudy throughout the day with afternoon rain.,rain,"96937099999,96973099999,remote"
sumenep,2/20/2023,30.6,25.1,27.3,37,25.1,29.4,24.4,84.7,64,100,12.5,rain,0,0,37.8,23,276.4,1008.6,79.1,17.2,284.1,24.4,9,30,2023-02-20T05:29:28,2023-02-20T17:47:17,0,"Rain, Partially cloudy",Partly cloudy throughout the day with rain.,rain,"96937099999,96973099999,remote"
sumenep,2/21/2023,30.5,24.9,27,36.8,24.9,28.9,24.4,85.9,16,100,8.33,rain,0,0,37.8,22.7,288.6,1009.3,84.2,18.1,244.8,21.1,9,30,2023-02-21T05:29:32,2023-02-21T17:46:59,0.03,"Rain, Partially cloudy",Partly cloudy throughout the day with afternoon rain.,rain,"96937099999,96973099999,remote"
sumenep,2/22/2023,31.7,25.2,27.3,39.5,25.2,29.6,24.3,84.3,0.3,100,4.17,rain,0,0,48.2,33.5,283.4,1008.9,81.3,19,234,20.2,7,60,2023-02-22T05:29:36,2023-02-22T17:46:40,0.06,"Rain, Partially cloudy",Partly cloudy throughout the day with early morning rain.,rain,"96937099999,96973099999,remote"
sumenep,2/23/2023,29.9,25.8,27.3,35.8,25.8,30,24.5,84.5,6.5,100,45.83,rain,0,0,47.9,29.5,283.2,1008,93.5,19.2,182.9,15.8,7,60,2023-02-23T05:29:40,2023-02-23T17:46:21,0.1,"Rain, Overcast",Cloudy skies throughout the day with a chance of rain throughout the day.,rain,"96937099999,96973099999,remote"
sumenep,2/24/2023,31.5,25.9,27.8,37.4,25.9,31.3,24.4,82.1,0.7,100,4.17,rain,0,0,54.7,43,267.2,1008.5,86.3,18.8,229.4,19.8,8,30,2023-02-24T05:29:43,2023-02-24T17:46:01,0.13,"Rain, Partially cloudy",Partly cloudy throughout the day with morning rain.,rain,"96937099999,96973099999,remote"
sumenep,2/25/2023,31.4,25.6,28,39,25.6,31.5,24.2,79.9,1.7,100,29.17,rain,0,0,53.6,42.5,278.2,1009.7,79.7,17.7,259.1,22.5,9,75,2023-02-25T05:29:45,2023-02-25T17:45:41,0.16,"Rain, Partially cloudy",Partly cloudy throughout the day with rain.,rain,"96937099999,96973099999,remote"
sumenep,2/26/2023,29.4,26,27.3,34.8,26,29.4,24,82.4,3.2,100,45.83,rain,0,0,62.3,37.1,288.1,1010.3,94.4,17.6,221.4,19.1,8,30,2023-02-26T05:29:47,2023-02-26T17:45:20,0.19,"Rain, Overcast",Cloudy skies throughout the day with a chance of rain throughout the day.,rain,"96937099999,96973099999,remote"
sumenep,2/27/2023,29.2,25.6,26.7,34.4,25.6,28,24.1,86,11.9,100,62.5,rain,0,0,50.8,31.3,282.2,1010.6,93.9,18.2,129.5,11.3,5,30,2023-02-27T05:29:48,2023-02-27T17:44:58,0.25,"Rain, Overcast",Cloudy skies throughout the day with a chance of rain throughout the day.,rain,"96937099999,96973099999,remote"
sumenep,2/28/2023,31.4,25.4,27.4,38.5,25.4,29.7,24,81.9,1,100,4.17,rain,0,0,42.8,28.1,283.6,1010.6,93.5,19.3,160.5,13.9,8,30,2023-02-28T05:29:49,2023-02-28T17:44:36,0.26,"Rain, Overcast",Cloudy skies throughout the day with morning rain.,rain,"96937099999,96973099999,remote"
sumenep,3/1/2023,29.7,24.7,26.8,34.7,24.7,28.4,23.7,83.8,21.1,100,12.5,rain,0,0,38.9,24.1,281.6,1010.5,91,16,183.1,15.7,6,30,2023-03-01T05:29:49,2023-03-01T17:44:13,0.29,"Rain, Overcast",Cloudy skies throughout the day with rain.,rain,"96937099999,96973099999,remote"
sumenep,3/2/2023,26.8,25,25.8,29.6,25,25.9,23.8,88.6,17,100,8.33,rain,0,0,55.4,30.2,296.1,1011.9,97.1,9.4,72.9,6.3,4,30,2023-03-02T05:29:49,2023-03-02T17:43:49,0.33,"Rain, Overcast",Cloudy skies throughout the day with afternoon rain.,rain,"96937099999,96973099999,remote"
sumenep,3/3/2023,29.5,24.3,27.2,35.3,24.3,29.7,24.2,83.8,1,100,4.17,rain,0,0,34.2,16.2,290.4,1012.2,66.5,19.4,258.4,22.4,10,30,2023-03-03T05:29:49,2023-03-03T17:43:26,0.36,"Rain, Partially cloudy",Partly cloudy throughout the day with afternoon rain.,rain,"96937099999,96973099999,remote"
sumenep,3/4/2023,30.4,24.7,27.3,37.1,24.7,29.6,24.4,84.6,23,100,8.33,rain,0,0,29.2,15.1,282.3,1012.7,65.2,14.6,281.3,24.4,9,30,2023-03-04T05:29:47,2023-03-04T17:43:01,0.39,"Rain, Partially cloudy",Partly cloudy throughout the day with rain clearing later.,rain,"96937099999,96973099999,remote"
sumenep,3/5/2023,30.9,24.6,26.9,38.9,24.6,29,24.1,85.1,22,100,8.33,rain,0,0,29.9,17.6,288.5,1012.1,94.4,15.1,274.4,23.5,10,30,2023-03-05T05:29:46,2023-03-05T17:42:36,0.42,"Rain, Overcast",Cloudy skies throughout the day with rain.,rain,"96937099999,96973099999,remote"
sumenep,3/6/2023,31.1,24.7,27,37.8,24.7,29.5,24.4,86,1,100,4.17,rain,0,0,27.4,14.4,273.3,1011.3,80.5,17.4,210.4,18.1,8,30,2023-03-06T05:29:44,2023-03-06T17:42:11,0.46,"Rain, Partially cloudy",Partly cloudy throughout the day with early morning rain.,rain,"96937099999,96973099999,remote"
sumenep,3/7/2023,31.7,25.3,27.5,37.7,25.3,30.3,24.5,83.9,1.3,100,20.83,rain,0,0,19.1,11.2,290.1,1011.2,57.6,19.2,286.2,24.8,9,30,2023-03-07T05:29:41,2023-03-07T17:41:45,0.5,"Rain, Partially cloudy",Partly cloudy throughout the day with rain.,rain,"96937099999,96973099999,remote"
sumenep,3/8/2023,30.7,25.7,27.3,38.3,25.7,29.6,24.5,84.6,5.4,100,45.83,rain,0,0,17.3,10.1,245.9,1012.1,65.8,15.5,282.8,24.4,10,30,2023-03-08T05:29:39,2023-03-08T17:41:19,0.52,"Rain, Partially cloudy",Partly cloudy throughout the day with a chance of rain throughout the day.,rain,"96937099999,96973099999,remote"
sumenep,3/9/2023,32.1,25.1,27.8,40.5,25.1,30.5,24.3,81.9,1.3,100,45.83,rain,0,0,14.8,7.6,70.9,1010.9,36.2,17.7,275.8,23.7,10,30,2023-03-09T05:29:36,2023-03-09T17:40:52,0.56,"Rain, Partially cloudy",Partly cloudy throughout the day with a chance of rain throughout the day.,rain,"96937099999,96973099999,remote"
sumenep,3/10/2023,32.1,25.4,27.9,38.4,25.4,31.1,24.7,83.2,1.3,100,41.67,rain,0,0,14.8,14.8,138.5,1010.2,43,18,288.4,24.9,10,30,2023-03-10T05:29:32,2023-03-10T17:40:26,0.59,"Rain, Partially cloudy",Partly cloudy throughout the day with a chance of rain throughout the day.,rain,"96937099999,96973099999,remote"
sumenep,3/11/2023,32.9,25.7,28.7,42.1,25.7,33,24.6,79.2,0.6,100,20.83,rain,0,0,15.5,12.2,257.5,1010.3,27.7,18.2,293.8,25.2,10,30,2023-03-11T05:29:28,2023-03-11T17:39:58,0.63,"Rain, Partially cloudy",Partly cloudy throughout the day with rain.,rain,"96937099999,96973099999,remote"
sumenep,3/12/2023,30.6,25.4,27.6,37.2,25.4,30.8,24.5,83.6,46.2,100,8.33,rain,0,0,23.8,13,287.3,1010.1,41.5,18.7,278.3,24,10,30,2023-03-12T05:29:24,2023-03-12T17:39:31,0.66,"Rain, Partially cloudy",Partly cloudy throughout the day with afternoon rain.,rain,"96937099999,96973099999,remote"
sumenep,3/13/2023,30.9,25.5,26.9,38.9,25.5,28.6,24.2,85.3,8,100,4.17,rain,0,0,18.4,24.1,134.1,1009.3,77.9,15.6,241.7,20.8,8,10,2023-03-13T05:29:20,2023-03-13T17:39:03,0.7,"Rain, Partially cloudy",Partly cloudy throughout the day with morning rain.,rain,"96937099999,96973099999,remote"
sumenep,3/14/2023,29.4,24.4,26.5,36.6,24.4,28.3,24.2,87.5,12.4,100,8.33,rain,0,0,22,11.5,23.1,1009.5,81.8,15.6,211.2,18.1,8,10,2023-03-14T05:29:15,2023-03-14T17:38:35,0.74,"Rain, Partially cloudy",Partly cloudy throughout the day with afternoon rain.,rain,"96937099999,96973099999,remote"
sumenep,3/15/2023,32.3,25.1,27.9,39.7,25.1,31,24.1,80.3,0.3,100,8.33,rain,0,0,20.2,15.5,91,1010.2,73.1,19.3,272.8,23.5,10,30,2023-03-15T05:29:10,2023-03-15T17:38:06,0.75,"Rain, Partially cloudy",Partly cloudy throughout the day with rain.,rain,"96937099999,96973099999,remote"
sumenep,3/16/2023,31.3,26.2,28.6,39,26.2,32.9,24.4,78.4,0.1,100,4.17,rain,0,0,17.3,8.6,75.2,1010.7,63.9,18.1,287.1,24.8,10,30,2023-03-16T05:29:05,2023-03-16T17:37:38,0.81,"Rain, Partially cloudy",Partly cloudy throughout the day with early morning rain.,rain,"96937099999,96973099999,remote"
sumenep,3/17/2023,32.4,25.4,28.4,40.9,25.4,32.5,24.4,79.5,0.5,100,20.83,rain,0,0,16.9,13,89.1,1010.4,77.8,18.2,283.7,24.6,10,60,2023-03-17T05:29:00,2023-03-17T17:37:09,0.84,"Rain, Partially cloudy",Partly cloudy throughout the day with rain.,rain,"96937099999,96973099999,remote"
sumenep,3/18/2023,32.2,25.2,28.1,41.9,25.2,31.9,24.6,81.5,0.8,100,33.33,rain,0,0,20.9,24.1,109.7,1009.6,51,19,300.5,26,10,60,2023-03-18T05:28:54,2023-03-18T17:36:40,0.88,"Rain, Partially cloudy",Partly cloudy throughout the day with a chance of rain throughout the day.,rain,"96937099999,96973099999,remote"
sumenep,3/19/2023,32.7,25.5,28.5,39.7,25.5,32.9,24.9,81.5,0.6,100,20.83,rain,0,0,28.1,23,104.3,1009.1,46.3,19,295.9,25.7,10,30,2023-03-19T05:28:48,2023-03-19T17:36:11,0.91,"Rain, Partially cloudy",Partly cloudy throughout the day with rain.,rain,"96937099999,96973099999,remote"
sumenep,3/20/2023,33.4,25.7,28.1,41.7,25.7,31.2,24.8,83.3,13.1,100,58.33,rain,0,0,20.2,20.4,119.8,1009,78.7,17.4,271.6,23.4,9,30,2023-03-20T05:28:42,2023-03-20T17:35:41,0.95,"Rain, Partially cloudy",Partly cloudy throughout the day with a chance of rain throughout the day.,rain,"96937099999,96973099999,remote"
sumenep,3/21/2023,32.7,25.4,28.1,40.3,25.4,31.5,24.4,81.1,20,100,4.17,rain,0,0,15.1,9,45.8,1008.9,85.3,19.2,276.9,23.8,10,30,2023-03-21T05:28:36,2023-03-21T17:35:12,0.98,"Rain, Partially cloudy",Partly cloudy throughout the day with early morning rain.,rain,"96937099999,96973099999,remote"
sumenep,3/22/2023,31,25.7,27.8,39,25.7,31.3,24.6,83.1,33.2,100,12.5,rain,0,0,21.6,7.9,299.5,1008.5,60.3,18.6,280.8,24.3,10,30,2023-03-22T05:28:30,2023-03-22T17:34:43,0,"Rain, Partially cloudy",Partly cloudy throughout the day with rain.,rain,"96937099999,96973099999,remote"
sumenep,3/23/2023,30.9,25.7,28.1,38.5,25.7,31.8,24.9,82.9,13,100,4.17,rain,0,0,16.9,22.6,302.7,1008.4,50.2,18.9,285.8,24.7,10,30,2023-03-23T05:28:24,2023-03-23T17:34:13,0.05,"Rain, Partially cloudy",Partly cloudy throughout the day with afternoon rain.,rain,"96937099999,96973099999,remote"
sumenep,3/24/2023,32.5,25.7,28.4,40.3,25.7,32.5,24.8,81.7,1.9,100,29.17,rain,0,0,16.9,9.7,245.5,1009,44.3,18.8,286.1,24.6,10,30,2023-03-24T05:28:17,2023-03-24T17:33:43,0.08,"Rain, Partially cloudy",Partly cloudy throughout the day with a chance of rain throughout the day.,rain,"96937099999,96973099999,remote"
sumenep,3/25/2023,31,25.9,28,38.2,25.9,31.5,24.6,82.1,3,100,4.17,rain,0,0,21.2,13.3,297.2,1009.3,68.6,19.2,276.1,23.8,10,30,2023-03-25T05:28:11,2023-03-25T17:33:14,0.11,"Rain, Partially cloudy",Partly cloudy throughout the day with afternoon rain.,rain,"96937099999,96973099999,remote"
sumenep,3/26/2023,29.1,25.5,27.2,34.8,25.5,29.6,24.5,85.5,4.8,100,62.5,rain,0,0,25.6,14.8,298.4,1008.7,86.4,17.9,182.4,15.7,8,30,2023-03-26T05:28:04,2023-03-26T17:32:44,0.14,"Rain, Partially cloudy",Partly cloudy throughout the day with a chance of rain throughout the day.,rain,"96937099999,96973099999,remote"
sumenep,3/27/2023,31.2,25.4,27.5,38.2,25.4,30.3,24.6,84.7,11.8,100,62.5,rain,0,0,31.3,20.5,292.1,1009.1,77.7,18.9,203.7,17.5,7,30,2023-03-27T05:27:58,2023-03-27T17:32:14,0.18,"Rain, Partially cloudy",Partly cloudy throughout the day with a chance of rain throughout the day.,rain,"96937099999,96973099999,remote"
sumenep,3/28/2023,29.9,25.7,27.2,37.6,25.7,29.9,24.8,87.3,43,100,16.67,rain,0,0,34.6,20.9,290.1,1009.7,92.8,16.6,221.1,19,8,60,2023-03-28T05:27:51,2023-03-28T17:31:45,0.21,"Rain, Overcast",Cloudy skies throughout the day with rain.,rain,"96937099999,96973099999,remote"
sumenep,3/29/2023,30.5,25.2,27.7,37.1,25.2,31.2,24.8,84.7,1.1,100,8.33,rain,0,0,22,11.5,293.4,1009.3,92.1,16.7,215.9,18.6,8,30,2023-03-29T05:27:44,2023-03-29T17:31:15,0.25,"Rain, Overcast",Cloudy skies throughout the day with afternoon rain.,rain,"96937099999,96973099999,remote"
sumenep,3/30/2023,31.1,25.7,27.4,39.3,25.7,29.9,24.6,85,7,100,8.33,rain,0,0,21.2,16.6,264.2,1008.7,90,17.7,191.7,16.4,7,60,2023-03-30T05:27:38,2023-03-30T17:30:46,0.27,"Rain, Partially cloudy",Partly cloudy throughout the day with rain.,rain,"96937099999,96973099999,remote"
sumenep,3/31/2023,30.9,25.4,26.8,38.4,25.4,28.5,24.3,86.6,4,100,12.5,rain,0,0,28.1,19.1,277.8,1009.5,94.4,15.5,168.7,14.6,6,30,2023-03-31T05:27:31,2023-03-31T17:30:17,0.31,"Rain, Overcast",Cloudy skies throughout the day with rain.,rain,"96937099999,96973099999,remote"
sumenep,4/1/2023,30.7,25.1,27,37.4,25.1,29.2,24,83.9,2,100,8.33,rain,0,0,21.2,16.6,318,1009.6,97,18.4,109.4,9.5,5,10,2023-04-01T05:27:25,2023-04-01T17:29:47,0.34,"Rain, Overcast",Cloudy skies throughout the day with early morning rain.,rain,"96937099999,96973099999,remote"
sumenep,4/2/2023,29.9,25,27,35.6,25,29,24.2,84.8,7.8,100,12.5,rain,0,0,14.8,14.8,303.4,1008.4,95.1,19.2,202.3,17.3,8,10,2023-04-02T05:27:18,2023-04-02T17:29:18,0.37,"Rain, Overcast",Cloudy skies throughout the day with rain.,rain,"96937099999,96973099999,remote"
sumenep,4/3/2023,29.9,25,26.9,37.4,25,28.8,24.6,87.2,11,100,12.5,rain,0,0,19.4,16.6,266.2,1008.6,94.4,18,197.9,17,7,30,2023-04-03T05:27:12,2023-04-03T17:28:49,0.4,"Rain, Overcast",Cloudy skies throughout the day with rain.,rain,"96937099999,96973099999,remote"
sumenep,4/4/2023,30.5,25.1,27.2,36.8,25.1,29.8,24.3,84.3,11,100,45.83,rain,0,0,23,11.9,269.6,1009.7,94.4,19.4,165.5,14,7,30,2023-04-04T05:27:06,2023-04-04T17:28:21,0.44,"Rain, Overcast",Cloudy skies throughout the day with a chance of rain throughout the day.,rain,"96937099999,96973099999,remote"
sumenep,4/5/2023,30.4,25.7,27.5,36.6,25.7,30.5,24.4,83.5,1.7,100,33.33,rain,0,0,18.7,11.2,55.8,1009.4,64.4,17.2,249.2,21.4,9,30,2023-04-05T05:27:00,2023-04-05T17:27:52,0.47,"Rain, Partially cloudy",Partly cloudy throughout the day with a chance of rain throughout the day.,rain,"96937099999,96973099999,remote"
sumenep,4/6/2023,31.5,25.4,27.5,38.6,25.4,29.8,24.5,84.4,9.9,100,50,rain,0,0,17.3,9.4,211.4,1009.9,67.9,16,254.2,21.9,9,30,2023-04-06T05:26:54,2023-04-06T17:27:24,0.5,"Rain, Partially cloudy",Partly cloudy throughout the day with a chance of rain throughout the day.,rain,"96937099999,96973099999,remote"
sumenep,4/7/2023,31.4,25.1,27.4,36.5,25.1,30,24.3,84,4.9,100,45.83,rain,0,0,19.8,11.9,339.5,1010.4,94.2,17.6,222,19,8,60,2023-04-07T05:26:48,2023-04-07T17:26:56,0.54,"Rain, Overcast",Cloudy skies throughout the day with a chance of rain throughout the day.,rain,"96937099999,96973099999,remote"
sumenep,4/8/2023,31.3,25.5,27.4,37.7,25.5,29.6,24.5,84.6,0.1,100,4.17,rain,0,0,23,16.6,257.2,1011.1,89.6,18.3,249.5,21.4,9,30,2023-04-08T05:26:42,2023-04-08T17:26:28,0.57,"Rain, Partially cloudy",Partly cloudy throughout the day with late afternoon rain.,rain,"96937099999,96973099999,remote"
sumenep,4/9/2023,32.3,24.4,27.5,41.3,24.4,30.1,24.3,83,4,100,8.33,rain,0,0,31.7,18,272.8,1010.3,81.1,17.8,254.3,21.9,9,60,2023-04-09T05:26:37,2023-04-09T17:26:00,0.61,"Rain, Partially cloudy",Partly cloudy throughout the day with rain.,rain,"96937099999,96973099999,remote"
sumenep,4/10/2023,33.1,24.5,27.5,40.8,24.5,30.1,24.3,82.8,3.8,100,50,rain,0,0,36.4,30.7,281.1,1009.6,75.6,17.6,236.9,20.3,8,60,2023-04-10T05:26:32,2023-04-10T17:25:33,0.64,"Rain, Partially cloudy",Partly cloudy throughout the day with a chance of rain throughout the day.,rain,"96937099999,96973099999,remote"
sumenep,4/11/2023,31.4,25.2,28.2,39.2,25.2,32,24.5,80.5,1.1,100,33.33,rain,0,0,29.2,17.6,281.6,1008.8,61.1,19.8,258.1,22.2,9,30,2023-04-11T05:26:27,2023-04-11T17:25:06,0.68,"Rain, Partially cloudy",Partly cloudy throughout the day with a chance of rain throughout the day.,rain,"96937099999,96973099999,remote"
sumenep,4/12/2023,30.9,26.7,28.3,39.4,29.7,33.1,25.1,83,3.3,100,12.5,rain,0,0,25.6,14,279.6,1008.3,76.3,19.2,259.1,22.3,9,60,2023-04-12T05:26:22,2023-04-12T17:24:40,0.72,"Rain, Partially cloudy",Partly cloudy throughout the day with rain.,rain,"96937099999,96973099999,remote"
sumenep,4/13/2023,30,24.9,27.2,37.4,24.9,30,24.5,85.6,1.3,100,12.5,rain,0,0,22.7,13.7,240.9,1009,93.2,16.6,166.7,14.4,6,60,2023-04-13T05:26:17,2023-04-13T17:24:14,0.75,"Rain, Overcast",Cloudy skies throughout the day with rain.,rain,"96937099999,96973099999,remote"
sumenep,4/14/2023,31.4,25.1,27.6,39.1,25.1,30.5,24.5,83.5,4.5,100,54.17,rain,0,0,16.6,7.9,93.7,1009.2,78.7,19.1,237.3,20.4,8,30,2023-04-14T05:26:13,2023-04-14T17:23:48,0.79,"Rain, Partially cloudy",Partly cloudy throughout the day with a chance of rain throughout the day.,rain,"96937099999,96973099999,remote"
sumenep,4/15/2023,31.7,25.6,27.6,39,25.6,30.6,24.7,84.7,24,100,8.33,rain,0,0,15.5,8.6,76.8,1009,77.2,17.1,244.1,21.1,8,30,2023-04-15T05:26:09,2023-04-15T17:23:22,0.82,"Rain, Partially cloudy",Partly cloudy throughout the day with afternoon rain.,rain,"96937099999,96973099999,remote"
sumenep,4/16/2023,31.9,24.9,27.5,41.8,24.9,30.3,24.7,85.2,42.4,100,8.33,rain,0,0,17.3,13,79.9,1009.1,79.5,18.6,220.1,18.9,8,60,2023-04-16T05:26:05,2023-04-16T17:22:57,0.86,"Rain, Partially cloudy",Partly cloudy throughout the day with rain clearing later.,rain,"96937099999,96973099999,remote"
sumenep,4/17/2023,30.7,25.8,27.6,38.7,25.8,31.2,25,85.8,0.6,100,4.17,rain,0,0,20.2,13,89.9,1010.8,76,17.4,237.8,20.5,9,60,2023-04-17T05:26:02,2023-04-17T17:22:33,0.89,"Rain, Partially cloudy",Partly cloudy throughout the day with afternoon rain.,rain,"96937099999,96973099999,remote"
sumenep,4/18/2023,32,25.9,28.4,41.6,25.9,33.4,25.5,84.7,1.5,100,45.83,rain,0,0,25.9,14.4,106.7,1011,76.3,19,261.4,22.7,9,60,2023-04-18T05:25:58,2023-04-18T17:22:09,0.93,"Rain, Partially cloudy",Partly cloudy throughout the day with a chance of rain throughout the day.,rain,"96937099999,96973099999,remote"
sumenep,4/19/2023,32.4,26.9,28.9,39.9,30.5,33.8,24.7,78.7,0.1,100,4.17,rain,0,0,19.1,13,104.6,1008.5,32.3,19.4,275.3,23.8,9,30,2023-04-19T05:25:56,2023-04-19T17:21:45,0.97,"Rain, Partially cloudy",Partly cloudy throughout the day with morning rain.,rain,"96937099999,96973099999,remote"
sumenep,4/20/2023,31.7,26.9,28.4,40.7,30.1,33.4,25.1,82.6,1.5,100,29.17,rain,0,0,19.8,13,110.5,1007.2,69,18.5,245,21.2,8,60,2023-04-20T05:25:53,2023-04-20T17:21:22,0,"Rain, Partially cloudy",Partly cloudy throughout the day with rain.,rain,"96937099999,96973099999,remote"
sumenep,4/21/2023,31.5,26.1,28,40.5,26.1,32.3,25.3,85.8,1.3,100,8.33,rain,0,0,24.8,26.3,105.6,1008.3,89.9,17.1,211.3,18.1,7,60,2023-04-21T05:25:51,2023-04-21T17:20:59,0.03,"Rain, Partially cloudy",Partly cloudy throughout the day with rain.,rain,"96937099999,96973099999,remote"
sumenep,4/22/2023,32.5,26.3,28.6,42.1,26.3,33.4,25.1,81.7,1.1,100,37.5,rain,0,0,29.5,19.4,105.7,1008.6,35,19,246.8,21.4,8,60,2023-04-22T05:25:49,2023-04-22T17:20:37,0.07,"Rain, Partially cloudy",Partly cloudy throughout the day with a chance of rain throughout the day.,rain,"96937099999,96973099999,remote"
sumenep,4/23/2023,32.3,26.7,29.2,40.7,26.7,34.1,24.6,76.8,0,0,0,,0,0,36.7,22,106.4,1009.1,36.1,19.4,269.3,23.3,9,30,2023-04-23T05:25:48,2023-04-23T17:20:15,0.1,Partially cloudy,Partly cloudy throughout the day.,partly-cloudy-day,"96937099999,96973099999,remote"
sumenep,4/24/2023,32.4,27.4,29.2,41.4,31,34.2,24.6,76.5,0,0,0,rain,0,0,35.3,25.9,103.4,1008.8,35,19.4,271.2,23.4,9,30,2023-04-24T05:25:47,2023-04-24T17:19:54,0.13,Partially cloudy,Partly cloudy throughout the day.,partly-cloudy-day,"96937099999,96973099999,remote"
sumenep,4/25/2023,32.2,26.7,28.8,41.1,30,33.7,24.8,79.4,0.4,100,12.5,rain,0,0,30.2,25.9,101.5,1008.5,74.2,19.3,246.8,21.4,9,60,2023-04-25T05:25:46,2023-04-25T17:19:34,0.16,"Rain, Partially cloudy",Partly cloudy throughout the day with rain in the morning and afternoon.,rain,"96937099999,96973099999,remote"
sumenep,4/26/2023,32.1,26.5,28.5,41.2,26.5,33.4,25.3,82.9,1.6,100,45.83,rain,0,0,32,18.7,103.3,1008.3,55.4,16.9,250.5,21.7,9,30,2023-04-26T05:25:46,2023-04-26T17:19:14,0.19,"Rain, Partially cloudy",Partly cloudy throughout the day with a chance of rain throughout the day.,rain,"96937099999,96973099999,remote"
sumenep,4/27/2023,32.7,26.8,28.8,42.2,30.4,34.3,25.3,81.7,0.3,100,12.5,rain,0,0,22,13,114.1,1008.4,71.1,18.5,249.3,21.6,9,30,2023-04-27T05:25:46,2023-04-27T17:18:54,0.23,"Rain, Partially cloudy",Partly cloudy throughout the day with a chance of rain throughout the day.,rain,"96937099999,96973099999,remote"
sumenep,4/28/2023,29.8,26.2,27.5,37.8,26.2,31.1,25.1,86.9,4.2,100,8.33,rain,0,0,21.2,14,95.5,1008.7,85.3,18.7,180.9,15.6,7,30,2023-04-28T05:25:46,2023-04-28T17:18:35,0.25,"Rain, Partially cloudy",Partly cloudy throughout the day with rain in the morning and afternoon.,rain,"96937099999,96973099999,remote"
sumenep,4/29/2023,29.1,25.5,26.9,36.5,25.5,29.2,24.8,88.4,13.6,100,8.33,rain,0,0,22.7,15.1,87.3,1008.8,93.1,17.8,108.8,9.4,5,30,2023-04-29T05:25:47,2023-04-29T17:18:17,0.29,"Rain, Overcast",Cloudy skies throughout the day with rain in the morning and afternoon.,rain,"96937099999,96973099999,remote"
sumenep,4/30/2023,32,25.5,28,40.6,25.5,31.8,25.3,85.6,5.9,100,58.33,rain,0,0,22.7,13.7,94.2,1007.9,67.9,17.7,207.3,18,8,30,2023-04-30T05:25:48,2023-04-30T17:18:00,0.32,"Rain, Partially cloudy",Partly cloudy throughout the day with a chance of rain throughout the day.,rain,"96937099999,96973099999,remote"
sumenep,5/1/2023,31.7,26.3,28,41.1,26.3,32.1,25.3,85.5,6,100,8.33,rain,0,0,16.2,18.4,98.9,1008.3,43,17.2,205.3,17.6,7,30,2023-05-01T05:25:50,2023-05-01T17:17:43,0.35,"Rain, Partially cloudy",Partly cloudy throughout the day with afternoon rain.,rain,"96937099999,96973099999,remote"
sumenep,5/2/2023,32.4,26.2,28.3,41.7,26.2,33.3,25.4,84.7,2,100,4.17,rain,0,0,23.4,18.4,94.8,1009.4,83,19.1,191.9,16.5,7,30,2023-05-02T05:25:52,2023-05-02T17:17:26,0.39,"Rain, Partially cloudy",Partly cloudy throughout the day with late afternoon rain.,rain,"96937099999,96973099999,remote"
sumenep,5/3/2023,32.3,26.4,28.7,41.2,26.4,33.9,25.3,82.4,4.3,100,33.33,rain,0,0,28.4,20.1,105.8,1009.5,50.1,19.3,216.4,18.8,8,30,2023-05-03T05:25:55,2023-05-03T17:17:11,0.42,"Rain, Partially cloudy",Partly cloudy throughout the day with a chance of rain throughout the day.,rain,"96937099999,96973099999,remote"
sumenep,5/4/2023,32.4,26.2,28.9,42.6,26.2,34.6,25.5,81.9,1,100,4.17,rain,0,0,29.2,25.9,102.1,1008.8,32.8,20,255.3,22.2,9,30,2023-05-04T05:25:58,2023-05-04T17:16:56,0.45,"Rain, Partially cloudy",Partly cloudy throughout the day with afternoon rain.,rain,"96937099999,96973099999,remote"
sumenep,5/5/2023,32.4,26.9,29.1,40.7,30.6,34.6,25.1,79.8,0.9,100,25,rain,0,0,26.3,24,116.8,1007,64.8,18.8,252.8,21.8,9,30,2023-05-05T05:26:01,2023-05-05T17:16:41,0.48,"Rain, Partially cloudy",Partly cloudy throughout the day with a chance of rain throughout the day.,rain,"96937099999,96973099999,remote"
sumenep,5/6/2023,34.7,27.1,28.8,43.9,30.8,34.3,25.4,82.3,1.6,100,29.17,rain,0,0,20.9,14,111.2,1007.3,40.5,18.6,238.3,20.6,8,30,2023-05-06T05:26:05,2023-05-06T17:16:28,0.5,"Rain, Partially cloudy",Partly cloudy throughout the day with a chance of rain throughout the day.,rain,"96937099999,96973099999,remote"
sumenep,5/7/2023,31.8,27.1,29,39.5,30.9,34,24.6,77.4,0,0,0,rain,0,0,20.5,13,125.8,1007.8,32.3,19.4,263.7,22.8,9,30,2023-05-07T05:26:10,2023-05-07T17:16:15,0.55,Partially cloudy,Partly cloudy throughout the day.,partly-cloudy-day,"96937099999,96973099999,remote"
sumenep,5/8/2023,32.4,26.4,29.1,38.3,26.4,33.5,24.1,74.7,0,0,0,,0,0,17.3,12.5,149.9,1008.6,73.2,19.4,264.3,22.8,9,10,2023-05-08T05:26:15,2023-05-08T17:16:02,0.59,Partially cloudy,Partly cloudy throughout the day.,partly-cloudy-day,"96937099999,96973099999,remote"
sumenep,5/9/2023,30,26.4,28,36.7,26.4,32.1,25,84.2,4.8,100,12.5,rain,0,0,25.2,11.2,115.8,1009.7,91.7,17.9,192.5,16.4,8,30,2023-05-09T05:26:20,2023-05-09T17:15:51,0.62,"Rain, Overcast",Cloudy skies throughout the day with rain in the morning and afternoon.,rain,"96937099999,96973099999,remote"
sumenep,5/10/2023,28.8,26.1,27.3,35.4,26.1,30.8,25.3,88.7,43.8,100,20.83,rain,0,0,40.3,24.5,102.1,1010.3,94,18.3,107.3,9.4,4,30,2023-05-10T05:26:25,2023-05-10T17:15:40,0.66,"Rain, Overcast",Cloudy skies throughout the day with a chance of rain throughout the day.,rain,"96937099999,96973099999,remote"
sumenep,5/11/2023,28.6,26.5,27.6,35.2,26.5,32,25.6,88.8,24.7,100,20.83,rain,0,0,37.8,23,106.3,1011.6,74.9,17.8,135.6,11.7,5,60,2023-05-11T05:26:32,2023-05-11T17:15:29,0.7,"Rain, Partially cloudy",Partly cloudy throughout the day with rain.,rain,"96937099999,96973099999,remote"
sumenep,5/12/2023,32,27.2,29.1,41.5,31.2,35.3,25.7,82.3,0.8,100,4.17,rain,0,0,39.2,23.4,109.1,1011.4,35.9,18.3,228.8,19.6,8,60,2023-05-12T05:26:38,2023-05-12T17:15:20,0.75,"Rain, Partially cloudy",Partly cloudy throughout the day with afternoon rain.,rain,"96937099999,96973099999,remote"
sumenep,5/13/2023,31.4,26.9,28.6,37,29.8,32.5,23.7,75.6,0,0,0,,0,0,28.8,29.4,140.1,1011.6,20.2,19.4,258.6,22.3,9,10,2023-05-13T05:26:45,2023-05-13T17:15:11,0.77,Partially cloudy,Partly cloudy throughout the day.,partly-cloudy-day,"96937099999,96973099999,remote"
sumenep,5/14/2023,31.2,26.1,28,36.4,26.1,30,22,70.2,0,0,0,,0,0,24.1,19.4,146.8,1012.3,24.5,19.4,269,23.2,9,10,2023-05-14T05:26:53,2023-05-14T17:15:03,0.8,Partially cloudy,Clearing in the afternoon.,partly-cloudy-day,"96937099999,96973099999,remote"
sumenep,5/15/2023,30.4,25.9,27.6,34.8,25.9,29.4,22.3,73.5,0,0,0,,0,0,24.8,16.6,125.2,1012.5,14.8,19.4,260,22.4,9,10,2023-05-15T05:27:00,2023-05-15T17:14:56,0.84,Clear,Clear conditions throughout the day.,clear-day,"96937099999,96973099999,remote"
sumenep,5/16/2023,31.3,25.4,27.6,34.9,25.4,29.3,22.1,72.4,0.5,100,16.67,rain,0,0,20.5,15.1,119.9,1013,21.5,19.4,259.9,22.4,9,10,2023-05-16T05:27:09,2023-05-16T17:14:49,0.88,"Rain, Partially cloudy",Partly cloudy throughout the day with rain clearing later.,rain,"96937099999,96973099999,remote"
sumenep,5/17/2023,30.6,25.1,27.8,35,25.1,29.9,22.5,73.6,0.1,100,4.17,rain,0,0,22,14.8,117.1,1013,24,19.2,242.1,21,8,10,2023-05-17T05:27:17,2023-05-17T17:14:43,0.91,"Rain, Partially cloudy",Partly cloudy throughout the day with late afternoon rain.,rain,"96937099999,96973099999,remote"
sumenep,5/18/2023,30.4,25.9,28,36,25.9,31,23.3,75.5,0.5,100,20.83,rain,0,0,26.3,15.1,122.8,1012.6,44.4,19.4,244.9,21.3,9,10,2023-05-18T05:27:26,2023-05-18T17:14:38,0.95,"Rain, Partially cloudy",Partly cloudy throughout the day with a chance of rain throughout the day.,rain,"96937099999,96973099999,remote"
sumenep,5/19/2023,30.8,26.5,28.2,36.1,26.5,31.3,23.3,75.2,0,0,0,rain,0,0,24.1,15.5,119.5,1012.2,74.8,18.9,240.7,20.9,8,10,2023-05-19T05:27:36,2023-05-19T17:14:33,0,Partially cloudy,Partly cloudy throughout the day.,partly-cloudy-day,"96937099999,96973099999,remote"
sumenep,5/20/2023,32.1,26.2,28.4,39.7,26.2,31.9,23.4,74.8,0,0,0,,0,0,28.1,16.6,110.6,1011.6,57.7,19.4,245.3,21.2,8,10,2023-05-20T05:27:46,2023-05-20T17:14:30,0.02,Partially cloudy,Partly cloudy throughout the day.,partly-cloudy-day,"96937099999,96973099999,remote"
sumenep,5/21/2023,32,25.7,28.2,37.7,25.7,31.2,23,73.8,0,0,0,rain,0,0,27.4,22.2,119.8,1012.5,59.3,19.3,244.2,21.2,8,10,2023-05-21T05:27:56,2023-05-21T17:14:27,0.05,Partially cloudy,Partly cloudy throughout the day.,partly-cloudy-day,"96937099999,96973099999,remote"
sumenep,5/22/2023,31.7,25.9,28.1,37.7,25.9,30.9,22.9,73.7,0.3,100,8.33,rain,0,0,28.4,15.1,117,1012.7,50.9,19.4,245.8,21.2,8,10,2023-05-22T05:28:06,2023-05-22T17:14:24,0.08,"Rain, Partially cloudy",Partly cloudy throughout the day with afternoon rain.,rain,"96937099999,96973099999,remote"
sumenep,5/23/2023,31.3,26.2,28.1,36.9,26.2,30.8,23,74.2,0,0,0,rain,0,0,27,16.6,112.4,1012.4,26.5,19.4,246.6,21.3,8,10,2023-05-23T05:28:17,2023-05-23T17:14:23,0.11,Partially cloudy,Partly cloudy throughout the day.,partly-cloudy-day,"96937099999,96973099999,remote"
sumenep,5/24/2023,32.4,25.7,28.3,39.2,25.7,32,23.9,77.2,0.6,100,16.67,rain,0,0,30.6,19.1,108.6,1013.3,35.4,19.4,246.9,21.2,8,10,2023-05-24T05:28:29,2023-05-24T17:14:22,0.15,"Rain, Partially cloudy",Partly cloudy throughout the day with rain in the morning and afternoon.,rain,"96937099999,96973099999,remote"
sumenep,5/25/2023,32,26.7,28.6,36.9,26.7,31.8,23,72.7,0,0,0,,0,0,25.9,21.9,113.9,1012.8,28.8,19.3,255.3,22.1,9,10,2023-05-25T05:28:40,2023-05-25T17:14:21,0.18,Partially cloudy,Partly cloudy throughout the day.,partly-cloudy-day,"96937099999,96973099999,remote"
sumenep,5/26/2023,32,25.7,28.3,38,25.7,31.2,22.7,72,0,0,0,,0,0,30.6,26.3,118.3,1012.2,54.6,19.4,251.5,21.8,9,10,2023-05-26T05:28:52,2023-05-26T17:14:22,0.21,Partially cloudy,Becoming cloudy in the afternoon.,partly-cloudy-day,"96937099999,96973099999,remote"
sumenep,5/27/2023,31.7,25.1,28.2,35.7,25.1,30.6,22,69.7,0,0,0,,0,0,30.6,18.8,126.2,1010.4,19.9,19.4,254.1,21.8,9,10,2023-05-27T05:29:04,2023-05-27T17:14:23,0.25,Clear,Clear conditions throughout the day.,clear-day,"96937099999,96973099999,remote"
sumenep,5/28/2023,31.4,25.7,27.8,35.8,25.7,29.6,21.7,69.7,0,0,0,,0,0,36,28.3,121.9,1010,16,19.4,250.6,21.7,9,10,2023-05-28T05:29:17,2023-05-28T17:14:24,0.28,Clear,Clear conditions throughout the day.,clear-day,"96937099999,96973099999,remote"
sumenep,5/29/2023,32.2,26.2,28.1,36,26.2,30.3,22.1,70.5,0,0,0,,0,0,31.7,19.1,114.7,1010.8,18.5,19.4,247.1,21.3,8,10,2023-05-29T05:29:30,2023-05-29T17:14:27,0.31,Clear,Clear conditions throughout the day.,clear-day,"96937099999,96973099999,remote"
sumenep,5/30/2023,31.5,25.2,28.2,36.8,25.2,31,23,73.9,0.1,100,4.17,rain,0,0,33.8,28.4,112.4,1011.2,40.5,19.3,235.6,20.3,8,10,2023-05-30T05:29:43,2023-05-30T17:14:30,0.34,"Rain, Partially cloudy",Partly cloudy throughout the day with late afternoon rain.,rain,"96937099999,96973099999,remote"
sumenep,5/31/2023,31.2,26.2,28.3,37.6,26.2,31.9,23.6,76,0.1,100,4.17,rain,0,0,32,17.3,116.3,1011,39.5,19.1,244.5,21,8,10,2023-05-31T05:29:56,2023-05-31T17:14:34,0.37,"Rain, Partially cloudy",Partly cloudy throughout the day with early morning rain.,rain,"96937099999,96973099999,remote"
sumenep,6/1/2023,30.7,25.7,28.5,36.8,25.7,31.9,23.4,74.6,0,0,0,,0,0,27.7,25.9,121.1,1010.6,77.4,20.1,244.3,21.1,9,10,2023-06-01T05:30:10,2023-06-01T17:14:38,0.4,Partially cloudy,Partly cloudy throughout the day.,partly-cloudy-day,"96973099999,remote"
sumenep,6/2/2023,31.9,26.1,28.6,38.8,26.1,32.4,23.9,76.4,0,0,0,,0,0,31,22.3,127,1011,76.1,19.2,227.9,19.6,8,10,2023-06-02T05:30:23,2023-06-02T17:14:43,0.44,Partially cloudy,Partly cloudy throughout the day.,partly-cloudy-day,"96937099999,96973099999,remote"
sumenep,6/3/2023,32.6,27,28.8,38.8,29.7,32.6,23.5,73.3,0,0,0,rain,0,0,29.5,24.1,119,1011,25.3,19.4,243,21.1,8,10,2023-06-03T05:30:37,2023-06-03T17:14:48,0.47,Partially cloudy,Partly cloudy throughout the day.,partly-cloudy-day,"96937099999,96973099999,remote"
sumenep,6/4/2023,32.4,25.9,28.6,38.5,25.9,32.1,23.4,74,0,0,0,,0,0,21.6,16.9,118.8,1010.1,29,19.3,240.5,20.8,8,10,2023-06-04T05:30:51,2023-06-04T17:14:54,0.5,Partially cloudy,Partly cloudy throughout the day.,partly-cloudy-day,"96937099999,96973099999,remote"
sumenep,6/5/2023,31.5,26.7,28.6,37,26.7,32.1,23.6,75,0,0,0,,0,0,23.4,15.1,120.4,1010,74.5,19.3,237,20.5,8,10,2023-06-05T05:31:05,2023-06-05T17:15:01,0.54,Partially cloudy,Partly cloudy throughout the day.,partly-cloudy-day,"96937099999,96973099999,remote"
sumenep,6/6/2023,32.1,26.1,28.8,39.8,26.1,32.7,23.6,74.1,0,0,0,,0,0,29.2,19.7,121.5,1010.4,57.1,19.2,230.6,19.9,8,10,2023-06-06T05:31:20,2023-06-06T17:15:08,0.57,Partially cloudy,Partly cloudy throughout the day.,partly-cloudy-day,"96937099999,96973099999,remote"
sumenep,6/7/2023,31,26.4,28.6,37.8,26.4,32.6,24,76.6,0.4,100,16.67,rain,0,0,34.9,20.9,117.7,1011.6,40.6,19.4,221.4,19,8,10,2023-06-07T05:31:34,2023-06-07T17:15:15,0.61,"Rain, Partially cloudy",Partly cloudy throughout the day with rain.,rain,"96937099999,96973099999,remote"
sumenep,6/8/2023,31.3,26.8,28.4,37.8,29.7,32.4,23.8,76.5,0.2,100,8.33,rain,0,0,29.2,19.2,112.8,1011.5,19.4,20.1,239.3,20.5,8,10,2023-06-08T05:31:48,2023-06-08T17:15:24,0.64,Rain,Clear conditions throughout the day with early morning rain.,rain,"96937099999,96973099999,remote"
sumenep,6/9/2023,32.1,25.1,28.1,38.2,25.1,30.9,23.3,75.7,0,0,0,rain,0,0,23.4,12.2,122.4,1010.6,14.1,19.4,248.8,21.4,9,10,2023-06-09T05:32:03,2023-06-09T17:15:32,0.68,Clear,Clear conditions throughout the day.,clear-day,"96937099999,96973099999,remote"
sumenep,6/10/2023,32.7,24.5,28.3,39.5,24.5,31.3,23.4,75.8,0.1,100,4.17,rain,0,0,24.5,19.7,110.3,1010.1,13,19.4,247.3,21.4,9,10,2023-06-10T05:32:17,2023-06-10T17:15:41,0.72,Rain,Clear conditions throughout the day with late afternoon rain.,rain,"96937099999,96973099999,remote"
sumenep,6/11/2023,31.7,26.6,28.6,38.8,26.6,32.7,24,76.4,2.6,100,8.33,rain,0,0,34.9,25.9,114.6,1010.1,55.6,19.4,204.2,17.6,7,30,2023-06-11T05:32:32,2023-06-11T17:15:51,0.75,"Rain, Partially cloudy",Partly cloudy throughout the day with morning rain.,rain,"96937099999,96973099999,remote"
sumenep,6/12/2023,31.6,26.5,28.7,40.2,26.5,33.1,24.3,77.4,28,100,8.33,rain,0,0,33.1,19.8,107.8,1010.7,75.6,19.2,226,19.4,8,30,2023-06-12T05:32:47,2023-06-12T17:16:01,0.79,"Rain, Partially cloudy",Partly cloudy throughout the day with rain.,rain,"96937099999,96973099999,remote"
sumenep,6/13/2023,32.1,26.9,28.4,38.8,29.9,32.1,23.5,74.9,0,0,0,rain,0,0,37.4,23.7,109,1010.6,57.1,19.3,224.1,19.4,8,10,2023-06-13T05:33:01,2023-06-13T17:16:11,0.82,Partially cloudy,Clearing in the afternoon.,partly-cloudy-day,"96937099999,96973099999,remote"
sumenep,6/14/2023,31.3,26.6,28.2,35.6,26.6,31,22.6,72,0,0,0,,0,0,31,21.2,123.8,1011.6,70.7,19.3,237.9,20.6,8,10,2023-06-14T05:33:15,2023-06-14T17:16:22,0.86,Partially cloudy,Partly cloudy throughout the day.,partly-cloudy-day,"96937099999,96973099999,remote"
sumenep,6/15/2023,31.4,26.3,27.9,36.1,26.3,30.2,22.8,74.1,0,0,0,,0,0,28.4,25.9,112.5,1011.3,70.9,19.9,239.6,20.7,8,10,2023-06-15T05:33:30,2023-06-15T17:16:33,0.89,Partially cloudy,Partly cloudy throughout the day.,partly-cloudy-day,"96937099999,96973099999,remote"
sumenep,6/16/2023,30.7,25.3,27.6,35.9,25.3,29.7,22.7,75,0,0,0,,0,0,24.5,15.1,110.1,1011.3,59.1,19.4,224.5,19.5,8,10,2023-06-16T05:33:44,2023-06-16T17:16:45,0.93,Partially cloudy,Partly cloudy throughout the day.,partly-cloudy-day,"96937099999,96973099999,remote"
sumenep,6/17/2023,31.6,24,27.7,37.7,24,29.9,23,76,0,0,0,,0,0,33.8,20.5,106,1011.4,33.8,19.4,232.7,20.1,8,10,2023-06-17T05:33:58,2023-06-17T17:16:57,0.96,Partially cloudy,Partly cloudy throughout the day.,partly-cloudy-day,"96937099999,96973099999,remote"
sumenep,6/18/2023,32,23.8,27.9,38.3,23.8,30.1,22.2,72,0,0,0,,0,0,31.7,27.7,95.5,1011.2,34.8,20,240,20.8,8,10,2023-06-18T05:34:12,2023-06-18T17:17:09,0,Partially cloudy,Partly cloudy throughout the day.,partly-cloudy-day,"96937099999,96973099999,remote"
sumenep,6/19/2023,30.7,24.1,27.9,37.3,24.1,30.5,22.9,75,0,0,0,,0,0,18.7,13,102.9,1011.1,29,19.4,245.1,21.1,8,10,2023-06-19T05:34:26,2023-06-19T17:17:21,0.03,Partially cloudy,Becoming cloudy in the afternoon.,partly-cloudy-day,"96937099999,96973099999,remote"
sumenep,6/20/2023,32.4,25.2,28.4,38.7,25.2,31.3,23.2,74.5,0,0,0,rain,0,0,24.1,14.8,96.2,1011.7,32.1,19.3,234.2,20.2,8,10,2023-06-20T05:34:39,2023-06-20T17:17:34,0.07,Partially cloudy,Partly cloudy throughout the day.,partly-cloudy-day,"96937099999,96973099999,remote"
sumenep,6/21/2023,32.1,26.4,28.5,39.8,26.4,32.1,23.7,75.5,0,0,0,,0,0,36.4,19.8,105.5,1011.4,31.3,19.4,240.1,20.7,8,10,2023-06-21T05:34:53,2023-06-21T17:17:47,0.1,Partially cloudy,Partly cloudy throughout the day.,partly-cloudy-day,"96937099999,96973099999,remote"
sumenep,6/22/2023,32.1,25.9,28.3,37.6,25.9,31.2,22.8,72.7,0,0,0,,0,0,28.8,16.2,116,1010.7,14.5,19.2,243.5,21,8,10,2023-06-22T05:35:06,2023-06-22T17:18:00,0.13,Clear,Clear conditions throughout the day.,clear-day,"96937099999,96973099999,remote"
sumenep,6/23/2023,30.4,25,27.8,34.7,25,29.5,22.4,73.2,0,0,0,,0,0,24.5,15.8,108.7,1010.3,13.7,19.4,247,21.2,8,10,2023-06-23T05:35:19,2023-06-23T17:18:13,0.16,Clear,Clear conditions throughout the day.,clear-day,"96937099999,96973099999,remote"
sumenep,6/24/2023,31.4,23.2,27.4,37.4,23.2,29.5,22.8,76.6,0,0,0,,0,0,25.2,20.5,109.3,1009.6,14.7,19.4,248.5,21.4,9,10,2023-06-24T05:35:31,2023-06-24T17:18:27,0.2,Clear,Clear conditions throughout the day.,clear-day,"96937099999,96973099999,remote"
sumenep,6/25/2023,31.5,24.4,27.7,36.3,24.4,29.6,22.9,75.9,0,0,0,,0,0,22.3,19.4,100.1,1009.5,14.7,19.4,245.8,21.2,8,10,2023-06-25T05:35:43,2023-06-25T17:18:40,0.23,Clear,Clear conditions throughout the day.,clear-day,"96937099999,96973099999,remote"
sumenep,6/26/2023,30.4,24.5,27.6,35.9,24.5,29.8,23.2,77.5,0,0,0,,0,0,18.4,14.8,121.4,1009.9,23.8,19.1,241.1,20.8,8,10,2023-06-26T05:35:55,2023-06-26T17:18:54,0.25,Partially cloudy,Partly cloudy throughout the day.,partly-cloudy-day,"96937099999,96973099999,remote"
sumenep,6/27/2023,31.4,24.7,28.3,36.5,24.7,30.7,22.8,72.9,0.1,100,4.17,rain,0,0,20.5,16.6,140.8,1011.1,9.4,19.4,243.1,20.9,8,10,2023-06-27T05:36:07,2023-06-27T17:19:08,0.29,Rain,Clear conditions throughout the day with late afternoon rain.,rain,"96937099999,96973099999,remote"
sumenep,6/28/2023,31.9,26.1,28.4,36.6,26.1,31.4,23.2,73.9,0,0,0,,0,0,23.8,18.4,128.4,1011.9,19.9,19.4,244,20.9,9,10,2023-06-28T05:36:18,2023-06-28T17:19:22,0.33,Clear,Clear conditions throughout the day.,clear-day,"96937099999,96973099999,remote"
sumenep,6/29/2023,31.6,25.5,28.6,37.4,25.5,31.8,23.3,73.9,0,0,0,,0,0,22.3,33.5,141.1,1010.8,27,19.4,242.8,20.9,8,10,2023-06-29T05:36:29,2023-06-29T17:19:36,0.36,Partially cloudy,Partly cloudy throughout the day.,partly-cloudy-day,"96937099999,96973099999,remote"
sumenep,6/30/2023,31.3,25.9,28.6,38.1,25.9,32.4,23.7,75,0,0,0,,0,0,21.2,13,142.4,1010.6,33.6,19.9,238.8,20.6,8,10,2023-06-30T05:36:39,2023-06-30T17:19:50,0.39,Partially cloudy,Partly cloudy throughout the day.,partly-cloudy-day,"96937099999,96973099999,remote"
sumenep,7/1/2023,30.9,25.9,28.5,37.5,25.9,32.2,23.8,76.1,0.6,100,20.83,rain,0,0,24.1,16.6,148,1010.9,31.9,18.9,224.9,19.5,8,10,2023-07-01T05:36:49,2023-07-01T17:20:04,0.43,"Rain, Partially cloudy",Partly cloudy throughout the day with rain.,rain,"96937099999,96973099999,remote"
sumenep,7/2/2023,31.3,25.8,28.4,37.5,25.8,31.5,23.4,74.8,6,100,4.17,rain,0,0,24.5,13,164.6,1011.8,79.7,19.2,214.5,18.4,8,10,2023-07-02T05:36:58,2023-07-02T17:20:17,0.46,"Rain, Partially cloudy",Partly cloudy throughout the day with morning rain.,rain,"96937099999,96973099999,remote"
sumenep,7/3/2023,31.2,26.1,28.3,37.2,26.1,31.6,23.4,75.2,0.4,100,16.67,rain,0,0,17.3,14.8,135.5,1011.3,87.7,17.8,223.2,19.1,8,10,2023-07-03T05:37:07,2023-07-03T17:20:31,0.5,"Rain, Partially cloudy",Partly cloudy throughout the day with rain.,rain,"96937099999,96973099999,remote"
sumenep,7/4/2023,30.9,26.2,28,37.7,26.2,31.3,23.9,78.4,0.5,100,4.17,rain,0,0,22.7,16.6,120.8,1010.5,55,18.9,215,18.5,8,10,2023-07-04T05:37:15,2023-07-04T17:20:45,0.53,"Rain, Partially cloudy",Partly cloudy throughout the day with morning rain.,rain,"96937099999,96973099999,remote"
sumenep,7/5/2023,31.4,26.1,28.3,37,26.1,31.7,24,77.9,0.4,100,16.67,rain,0,0,25.2,21.5,129.2,1009.9,40.6,19.2,220.1,18.9,8,10,2023-07-05T05:37:23,2023-07-05T17:20:59,0.56,"Rain, Partially cloudy",Partly cloudy throughout the day with rain.,rain,"96937099999,96973099999,remote"
sumenep,7/6/2023,33.1,26.6,28.7,40.9,26.6,32.9,24.1,76.7,0.5,100,4.17,rain,0,0,27,17.4,137.1,1010.9,32.4,19,218.3,18.9,8,10,2023-07-06T05:37:30,2023-07-06T17:21:12,0.6,"Rain, Partially cloudy",Partly cloudy throughout the day with late afternoon rain.,rain,"96937099999,96973099999,remote"
sumenep,7/7/2023,31.7,26,27.8,38.5,26,30.9,24.1,80.4,0.8,100,8.33,rain,0,0,32.4,22.3,151.8,1011.9,50.6,18.7,200.8,17.4,7,10,2023-07-07T05:37:37,2023-07-07T17:21:26,0.63,"Rain, Partially cloudy",Partly cloudy throughout the day with rain.,rain,"96937099999,96973099999,remote"
sumenep,7/8/2023,28.1,24.9,26.8,31.8,24.9,28.6,24,85.1,23.5,100,8.33,rain,0,0,29.9,16.6,106,1012.6,92.4,16.3,89,7.6,3,30,2023-07-08T05:37:43,2023-07-08T17:21:39,0.67,"Rain, Overcast",Cloudy skies throughout the day with rain in the morning and afternoon.,rain,"96937099999,96973099999,remote"
sumenep,7/9/2023,31.2,26.3,28.1,38.6,26.3,31.6,24.1,79.5,0.2,100,8.33,rain,0,0,34.9,21.2,114.6,1011.1,34.7,19.4,216.8,18.7,8,10,2023-07-09T05:37:48,2023-07-09T17:21:52,0.7,"Rain, Partially cloudy",Partly cloudy throughout the day with rain in the morning and afternoon.,rain,"96937099999,96973099999,remote"
sumenep,7/10/2023,30.5,25.7,28,36.3,25.7,31.2,23.4,76.7,0.1,100,4.17,rain,0,0,34.9,21.6,113,1010.8,17.8,19.4,236,20.4,8,10,2023-07-10T05:37:53,2023-07-10T17:22:05,0.75,Rain,Clear conditions throughout the day with morning rain.,rain,"96937099999,96973099999,remote"
sumenep,7/11/2023,31.3,25.4,27.9,35.2,25.4,29.9,21.8,69.9,0,0,0,,0,0,31,18,120.1,1011.6,33.2,19.1,249.9,21.7,9,10,2023-07-11T05:37:58,2023-07-11T17:22:18,0.77,Partially cloudy,Partly cloudy throughout the day.,partly-cloudy-day,"96937099999,96973099999,remote"
sumenep,7/12/2023,31.6,24.6,27.8,35.1,24.6,29.3,21.3,68.6,0,0,0,,0,0,24.8,15.1,142.5,1011.3,46.3,19.3,248.3,21.6,9,10,2023-07-12T05:38:01,2023-07-12T17:22:30,0.81,Partially cloudy,Becoming cloudy in the afternoon.,partly-cloudy-day,"96937099999,96973099999,remote"
sumenep,7/13/2023,30.9,26.1,28.3,36.7,26.1,31.3,22.9,72.6,0,0,0,,0,0,23,13,176.5,1011.2,79.8,19.4,234.2,20.3,8,10,2023-07-13T05:38:04,2023-07-13T17:22:42,0.84,Partially cloudy,Partly cloudy throughout the day.,partly-cloudy-day,"96937099999,96973099999,remote"
sumenep,7/14/2023,31.6,26.1,28.5,35.4,26.1,31.3,22.9,72.5,0.2,100,8.33,rain,0,0,24.5,22.6,156.9,1011.3,77.7,19.4,231.2,20.1,8,10,2023-07-14T05:38:06,2023-07-14T17:22:54,0.88,"Rain, Partially cloudy",Partly cloudy throughout the day with early morning rain.,rain,"96937099999,96973099999,remote"
sumenep,7/15/2023,31.3,25.2,28.1,36.3,25.2,30.6,22.5,72.4,0.1,100,4.17,rain,0,0,21.2,20.7,151.7,1011.1,72.9,19.4,232.1,20.1,8,10,2023-07-15T05:38:08,2023-07-15T17:23:06,0.91,"Rain, Partially cloudy",Partly cloudy throughout the day with late afternoon rain.,rain,"96937099999,96973099999,remote"
sumenep,7/16/2023,30.7,25.2,27.9,34.5,25.2,29.5,21.9,70.7,0.1,100,4.17,rain,0,0,29.5,25.8,140.3,1011.3,37.3,19.4,254.2,22,9,10,2023-07-16T05:38:09,2023-07-16T17:23:17,0.95,"Rain, Partially cloudy",Partly cloudy throughout the day with early morning rain.,rain,"96937099999,96973099999,remote"
sumenep,7/17/2023,31.4,25,27.8,35.3,25,29.6,21.5,69,0,0,0,,0,0,34.2,23,122.8,1011.1,43.9,19.4,257.5,22.2,9,10,2023-07-17T05:38:09,2023-07-17T17:23:28,0.98,Partially cloudy,Partly cloudy throughout the day.,partly-cloudy-day,"96937099999,96973099999,remote"
sumenep,7/18/2023,30.4,26.1,27.9,33.9,26.1,29.8,21.5,68.5,0,0,0,,0,0,35.3,20.9,127.7,1011.2,23.8,19.4,255.9,22,9,10,2023-07-18T05:38:09,2023-07-18T17:23:38,0,Partially cloudy,Partly cloudy throughout the day.,partly-cloudy-day,"96937099999,96973099999,remote"
sumenep,7/19/2023,31.2,26,27.9,33.4,26,29.3,21.2,67.9,0,0,0,,0,0,32.4,25.9,145.1,1010.7,5.8,19.4,254.2,22,9,10,2023-07-19T05:38:07,2023-07-19T17:23:49,0.05,Clear,Clear conditions throughout the day.,clear-day,"96937099999,96973099999,remote"
sumenep,7/20/2023,31.2,24.4,27.5,32.9,24.4,28.3,19.7,63.2,0,0,0,,0,0,31.3,17.3,142.7,1010.5,3.5,19.4,257,22.1,9,10,2023-07-20T05:38:05,2023-07-20T17:23:58,0.08,Clear,Clear conditions throughout the day.,clear-day,"96937099999,96973099999,remote"
sumenep,7/21/2023,30.9,24,27.6,34.1,24,28.8,20.2,64.8,0,0,0,,0,0,28.8,17.1,149.9,1012.5,11.5,19.3,254,21.9,9,10,2023-07-21T05:38:03,2023-07-21T17:24:08,0.11,Clear,Clear conditions throughout the day.,clear-day,"96937099999,96973099999,remote"
sumenep,7/22/2023,31.8,25.7,27.8,36,25.7,29.6,21.5,69,0,0,0,,0,0,38.2,23,119.9,1012.6,35.8,19.4,256.5,22.1,9,10,2023-07-22T05:37:59,2023-07-22T17:24:17,0.15,Partially cloudy,Clearing in the afternoon.,partly-cloudy-day,"96937099999,96973099999,remote"
sumenep,7/23/2023,31.4,25.7,27.6,35.7,25.7,29.3,21.5,69.6,0.2,100,8.33,rain,0,0,34.6,23,123.3,1012.6,39.7,19.4,257.1,22.1,9,10,2023-07-23T05:37:55,2023-07-23T17:24:26,0.18,"Rain, Partially cloudy",Partly cloudy throughout the day with early morning rain.,rain,"96937099999,96973099999,remote"
sumenep,7/24/2023,30.4,25.1,27.5,35.2,25.1,29.3,22.3,74,0.1,100,4.17,rain,0,0,31.3,28.1,114.8,1011.9,26.7,19.4,247.9,21.3,9,10,2023-07-24T05:37:50,2023-07-24T17:24:34,0.21,"Rain, Partially cloudy",Partly cloudy throughout the day with morning rain.,rain,"96937099999,96973099999,remote"
sumenep,7/25/2023,31.7,25.9,27.7,38.2,25.9,30.1,23,75.9,0,0,0,,0,0,34.2,21.2,108.9,1012.3,55.2,19.3,241,20.7,8,10,2023-07-25T05:37:45,2023-07-25T17:24:42,0.25,Partially cloudy,Partly cloudy throughout the day.,partly-cloudy-day,"96937099999,96973099999,remote"
sumenep,7/26/2023,30.8,25.8,27.6,35.1,25.8,29.2,21.8,71.2,0,0,0,,0,0,29.5,18.4,124.7,1013,27.9,19.4,260.6,22.6,9,10,2023-07-26T05:37:38,2023-07-26T17:24:49,0.25,Partially cloudy,Partly cloudy throughout the day.,partly-cloudy-day,"96937099999,96973099999,remote"
sumenep,7/27/2023,30.7,25.1,27.4,34.2,25.1,28.6,20.7,67.7,0,0,0,rain,0,0,25.9,27.7,137.2,1012.8,34.3,19.3,252.1,21.7,8,10,2023-07-27T05:37:31,2023-07-27T17:24:56,0.31,Partially cloudy,Partly cloudy throughout the day.,partly-cloudy-day,"96937099999,96973099999,remote"
sumenep,7/28/2023,30.3,24.2,27.2,33.1,24.2,28.1,20.2,66.2,0,0,0,,0,0,31,24.1,135.2,1012.7,47.8,19.4,254.7,21.9,9,10,2023-07-28T05:37:23,2023-07-28T17:25:03,0.35,Partially cloudy,Partly cloudy throughout the day.,partly-cloudy-day,"96937099999,96973099999,remote"
sumenep,7/29/2023,30.1,25.6,27.3,33.1,25.6,28.4,20.5,66.7,0,0,0,,0,0,34.9,27.3,126.2,1012.7,27.6,19.4,258.8,22.3,9,10,2023-07-29T05:37:14,2023-07-29T17:25:09,0.38,Partially cloudy,Clearing in the afternoon.,partly-cloudy-day,"96937099999,96973099999,remote"
sumenep,7/30/2023,30.2,25.3,27.4,33.6,25.3,28.7,21,68.3,0,0,0,,0,0,33.8,22.3,136.5,1012.6,38.4,19.4,267.6,23,9,10,2023-07-30T05:37:05,2023-07-30T17:25:14,0.41,Partially cloudy,Partly cloudy throughout the day.,partly-cloudy-day,"96937099999,96973099999,remote"
sumenep,7/31/2023,31.1,25.2,27.6,34.9,25.2,29.1,21.6,70.6,0,0,0,,0,0,36.7,34.1,131.2,1012.2,35.7,19.4,255.8,22,9,10,2023-07-31T05:36:55,2023-07-31T17:25:20,0.45,Partially cloudy,Becoming cloudy in the afternoon.,partly-cloudy-day,"96937099999,96973099999,remote"
sumenep,8/1/2023,31.9,25.9,27.9,37.9,25.9,30.8,23,74.9,0,0,0,,0,0,38.9,23.8,112.3,1012.2,54.4,19.4,254.2,21.9,9,10,2023-08-01T05:36:44,2023-08-01T17:25:24,0.48,Partially cloudy,Partly cloudy throughout the day.,partly-cloudy-day,"96937099999,96973099999,remote"
sumenep,8/2/2023,31.9,26.1,28.1,38.8,26.1,31.2,23.2,75.2,0,0,0,,0,0,35.6,22,109.6,1013.2,31.2,19.4,255.2,22.1,9,10,2023-08-02T05:36:32,2023-08-02T17:25:28,0.5,Partially cloudy,Partly cloudy throughout the day.,partly-cloudy-day,"96937099999,96973099999,remote"
sumenep,8/3/2023,31.5,25.7,27.9,37.3,25.7,30.4,23.1,75.8,0,0,0,,0,0,37.1,23.4,114,1013.8,36.3,19.4,257.8,22.1,9,10,2023-08-03T05:36:20,2023-08-03T17:25:32,0.55,Partially cloudy,Partly cloudy throughout the day.,partly-cloudy-day,"96937099999,96973099999,remote"
sumenep,8/4/2023,30.9,24.4,27.7,35.5,24.4,29.8,22.6,74.3,0,0,0,,0,0,32.8,24.4,125.7,1015.3,28.5,19.2,264.9,22.8,9,10,2023-08-04T05:36:07,2023-08-04T17:25:35,0.58,Partially cloudy,Becoming cloudy in the afternoon.,partly-cloudy-day,"96937099999,96973099999,remote"
sumenep,8/5/2023,31.6,26.2,28,36.5,26.2,30.4,22.2,70.8,0,0,0,,0,0,32.4,33.5,130,1014.4,7.4,19.4,265.4,22.7,9,10,2023-08-05T05:35:53,2023-08-05T17:25:38,0.62,Clear,Clear conditions throughout the day.,clear-day,"96937099999,96973099999,remote"
sumenep,8/6/2023,31.5,26.4,27.9,37.3,26.4,30.5,23,75.3,0.1,100,4.17,rain,0,0,33.1,31.2,122.6,1013.3,14.6,20,251.2,21.8,9,10,2023-08-06T05:35:38,2023-08-06T17:25:40,0.65,Rain,Clear conditions throughout the day with morning rain.,rain,"96937099999,96973099999,remote"
sumenep,8/7/2023,31.9,25.9,27.6,36.9,25.9,29.6,22.6,74.5,0.2,100,8.33,rain,0,0,40.3,31.7,113.1,1012.6,39.2,20,255.5,22,9,10,2023-08-07T05:35:23,2023-08-07T17:25:42,0.69,"Rain, Partially cloudy",Partly cloudy throughout the day with rain in the morning and afternoon.,rain,"96937099999,96973099999,remote"
sumenep,8/8/2023,31.7,25.2,27.4,36.7,25.2,28.7,21.9,72.4,0.1,100,4.17,rain,0,0,44.3,29.8,103.8,1013.3,25,19.4,249.1,21.6,8,10,2023-08-08T05:35:07,2023-08-08T17:25:44,0.75,"Rain, Partially cloudy",Partly cloudy throughout the day with morning rain.,rain,"96937099999,96973099999,remote"
sumenep,8/9/2023,30.6,25.1,27.2,33.8,25.1,28.4,21.3,70.9,0,0,0,,0,0,32,31.6,118.2,1014,42.2,19.4,261.7,22.4,9,10,2023-08-09T05:34:50,2023-08-09T17:25:44,0.75,Partially cloudy,Partly cloudy throughout the day.,partly-cloudy-day,"96937099999,96973099999,remote"
sumenep,8/10/2023,31.4,24.3,27,34.1,24.3,27.7,20.9,69.8,0,0,0,,0,0,28.8,19.2,119.2,1013.6,26,20.1,260.8,22.4,9,10,2023-08-10T05:34:33,2023-08-10T17:25:45,0.79,Partially cloudy,Partly cloudy throughout the day.,partly-cloudy-day,"96937099999,96973099999,remote"
sumenep,8/11/2023,30.9,24.8,26.9,33.6,24.8,27.8,20.6,68.8,0,0,0,,0,0,27.4,15.5,118.2,1013.2,28.6,19.4,267.1,23.1,9,10,2023-08-11T05:34:14,2023-08-11T17:25:45,0.82,Partially cloudy,Partly cloudy throughout the day.,partly-cloudy-day,"96937099999,96973099999,remote"
sumenep,8/12/2023,29.3,24.6,26.9,30.1,24.6,27.3,19.9,66.3,0,0,0,,0,0,25.2,16.6,117.8,1012.4,55.4,22.2,267.1,22.8,9,10,2023-08-12T05:33:56,2023-08-12T17:25:44,0.86,Partially cloudy,Becoming cloudy in the afternoon.,partly-cloudy-day,"96937099999,96973099999,remote"
sumenep,8/13/2023,30.9,25.4,27.4,35.4,25.4,29.1,21.7,71.2,0,0,0,rain,0,0,33.8,19.8,109.7,1012.4,48.3,21.7,259.5,22.3,9,10,2023-08-13T05:33:36,2023-08-13T17:25:43,0.89,Partially cloudy,Partly cloudy throughout the day.,partly-cloudy-day,"96937099999,96973099999,remote"
sumenep,8/14/2023,31.2,25.7,27.6,34.8,25.7,29,21.7,70.9,1,100,4.17,rain,0,0,31.7,20.1,116.2,1012.3,39.9,19.4,270.5,23.5,9,10,2023-08-14T05:33:16,2023-08-14T17:25:42,0.93,"Rain, Partially cloudy",Partly cloudy throughout the day with early morning rain.,rain,"96937099999,96973099999,remote"
sumenep,8/15/2023,31.2,25.6,27.7,35.8,25.6,29.5,22.3,72.9,0,0,0,rain,0,0,28.8,18.4,117.4,1013,39.7,19.4,272.9,23.5,9,10,2023-08-15T05:32:55,2023-08-15T17:25:40,0.96,Partially cloudy,Becoming cloudy in the afternoon.,partly-cloudy-day,"96937099999,96973099999,remote"
sumenep,8/16/2023,32.1,25.9,27.8,37,25.9,29.5,21.5,69.1,0.1,100,4.17,rain,0,0,27.7,18.4,128.4,1013.2,18.3,19.4,273.4,23.6,9,10,2023-08-16T05:32:34,2023-08-16T17:25:38,0,Rain,Clear conditions throughout the day with late afternoon rain.,rain,"96937099999,96973099999,remote"
sumenep,8/17/2023,31,24.9,27.5,34.9,24.9,28.9,21,68.3,0,0,0,,0,0,26.6,16.6,153.8,1012.2,20.5,20.1,281.8,24.2,10,10,2023-08-17T05:32:12,2023-08-17T17:25:35,0.03,Partially cloudy,Partly cloudy throughout the day.,partly-cloudy-day,"96937099999,96973099999,remote"
sumenep,8/18/2023,31.4,24,27.4,35.4,24,28.9,21.4,70.5,0,0,0,,0,0,29.9,22.3,132.8,1011.9,9.4,19.4,282.1,24.4,9,10,2023-08-18T05:31:49,2023-08-18T17:25:32,0.06,Clear,Clear conditions throughout the day.,clear-day,"96937099999,96973099999,remote"
sumenep,8/19/2023,30.6,24.2,27.3,35.6,24.2,29.2,22.4,75,0,0,0,,0,0,36,27.7,120.6,1012,42.5,19.4,260.2,22.4,8,10,2023-08-19T05:31:26,2023-08-19T17:25:28,0.1,Partially cloudy,Partly cloudy throughout the day.,partly-cloudy-day,"96937099999,96973099999,remote"
sumenep,8/20/2023,31.9,25.2,27.8,36.8,25.2,29.8,22.3,72.4,0,0,0,,0,0,39.2,25.2,111.6,1012.1,43.4,19.3,278.1,24,9,10,2023-08-20T05:31:03,2023-08-20T17:25:24,0.13,Partially cloudy,Partly cloudy throughout the day.,partly-cloudy-day,"96937099999,96973099999,remote"
sumenep,8/21/2023,30.4,26,27.5,35.3,26,29.5,22.5,74.5,1.2,100,8.33,rain,0,0,37.4,37.1,115.7,1011.9,25.1,19.3,256,21.9,9,10,2023-08-21T05:30:38,2023-08-21T17:25:20,0.16,"Rain, Partially cloudy",Clearing in the afternoon with rain in the morning and afternoon.,rain,"96937099999,96973099999,remote"
sumenep,8/22/2023,31.5,25.9,27.4,35.6,25.9,29,21.9,72,0.1,100,4.17,rain,0,0,39.6,21.6,118.2,1011.8,33,19.4,268,23.1,9,10,2023-08-22T05:30:13,2023-08-22T17:25:15,0.2,"Rain, Partially cloudy",Partly cloudy throughout the day with morning rain.,rain,"96937099999,96973099999,remote"
sumenep,8/23/2023,30.7,25.4,27.3,34.4,25.4,28.3,21.2,69.7,0,0,0,,0,0,33.5,29.5,126.1,1012.1,9.3,19.4,282.6,24.3,10,10,2023-08-23T05:29:48,2023-08-23T17:25:10,0.23,Clear,Clear conditions throughout the day.,clear-day,"96937099999,96973099999,remote"
sumenep,8/24/2023,31.2,24.8,27.7,38,24.8,29.5,21.7,70.4,0,0,0,,0,0,38.2,23,117.6,1011.7,11.6,19.4,283.5,24.4,10,10,2023-08-24T05:29:22,2023-08-24T17:25:04,0.25,Clear,Clear conditions throughout the day.,clear-day,"96937099999,96973099999,remote"
sumenep,8/25/2023,32.4,26.2,28,38,26.2,30.1,22.3,71.8,0,0,0,,0,0,30.6,19.1,120.2,1011.3,12.9,19.4,277.8,23.9,10,10,2023-08-25T05:28:56,2023-08-25T17:24:58,0.3,Clear,Clear conditions throughout the day.,clear-day,"96937099999,96973099999,remote"
sumenep,8/26/2023,31.7,25.6,27.7,35,25.6,29.2,21.7,70.4,0,0,0,,0,0,28.4,22.3,126.9,1011.4,18.1,19.4,284.5,24.6,10,10,2023-08-26T05:28:29,2023-08-26T17:24:52,0.33,Clear,Clear conditions throughout the day.,clear-day,"96937099999,96973099999,remote"
sumenep,8/27/2023,30.9,25.3,27.5,35.6,25.3,28.8,21.5,70.5,0,0,0,,0,0,26.3,24,127,1011.3,27.4,19.4,279.6,24,9,10,2023-08-27T05:28:02,2023-08-27T17:24:45,0.37,Partially cloudy,Partly cloudy throughout the day.,partly-cloudy-day,"96937099999,96973099999,remote"
sumenep,8/28/2023,31.5,25.7,27.5,35.7,25.7,28.9,21.7,70.9,0,0,0,,0,0,38.2,33,114.4,1011.3,22.6,20.1,291.5,25.3,10,10,2023-08-28T05:27:34,2023-08-28T17:24:39,0.4,Partially cloudy,Partly cloudy throughout the day.,partly-cloudy-day,"96937099999,96973099999,remote"
sumenep,8/29/2023,32.8,25.5,27.7,35.9,25.5,29.3,21.7,70.5,0,0,0,,0,0,36.4,29.5,115.6,1011.1,14.9,19.3,287.9,25,10,10,2023-08-29T05:27:06,2023-08-29T17:24:31,0.44,Clear,Clear conditions throughout the day.,clear-day,"96937099999,96973099999,remote"
sumenep,8/30/2023,30.5,26.2,27.6,34.4,26.2,29.4,22,71.6,0,0,0,,0,0,34.2,21.5,114.1,1011.3,27.8,19.4,284.3,24.6,10,10,2023-08-30T05:26:37,2023-08-30T17:24:24,0.47,Partially cloudy,Partly cloudy throughout the day.,partly-cloudy-day,"96937099999,96973099999,remote"
sumenep,8/31/2023,30.9,26,27.6,35.4,26,29.5,22.4,73.9,0,0,0,rain,0,0,32.8,20.8,117.1,1012.2,39.9,20,270.9,23.4,9,10,2023-08-31T05:26:08,2023-08-31T17:24:16,0.5,Partially cloudy,Becoming cloudy in the afternoon.,partly-cloudy-day,"96937099999,96973099999,remote"
sumenep,9/1/2023,30.5,25.6,27.2,34.1,25.6,28.3,21,69.1,0.1,100,4.17,rain,0,0,33.8,25.5,118.3,1012,25,20.1,265,22.8,9,10,2023-09-01T05:25:39,2023-09-01T17:24:08,0.54,"Rain, Partially cloudy",Partly cloudy throughout the day with afternoon rain.,rain,"96937099999,96973099999,remote"
sumenep,9/2/2023,30.1,25.3,27.1,32.9,25.3,27.9,19.9,65.1,0,0,0,,0,0,34.9,22.3,117,1011.3,42.4,19.4,295.8,25.5,10,10,2023-09-02T05:25:09,2023-09-02T17:24:00,0.57,Partially cloudy,Partly cloudy throughout the day.,partly-cloudy-day,"96937099999,96973099999,remote"
sumenep,9/3/2023,28.7,24.9,26.7,29.8,24.9,27.1,19.5,65.2,0,0,0,,0,0,32.8,19.8,111.2,1011.5,53.9,24.1,292.1,25.3,10,10,2023-09-03T05:24:39,2023-09-03T17:23:51,0.6,Partially cloudy,Becoming cloudy in the afternoon.,partly-cloudy-day,remote
sumenep,9/4/2023,31.3,24.8,27,33,24.8,27.6,19.9,66.1,0,0,0,,0,0,32,21.5,124,1010.6,45.8,19.4,292.4,25.2,10,10,2023-09-04T05:24:09,2023-09-04T17:23:43,0.64,Partially cloudy,Partly cloudy throughout the day.,partly-cloudy-day,"96937099999,96973099999,remote"
sumenep,9/5/2023,31.1,24.5,27.6,34.6,24.5,29,20.8,67.1,0,0,0,,0,0,32,22.3,127,1011.5,16.9,19.4,290.4,25.1,10,10,2023-09-05T05:23:38,2023-09-05T17:23:34,0.67,Clear,Clear conditions throughout the day.,clear-day,"96937099999,96973099999,remote"
sumenep,9/6/2023,32,25.8,28.1,36.4,25.8,30.1,22,70.2,0.1,100,4.17,rain,0,0,30.6,26.3,124.9,1011.7,24.1,19.4,292.9,25.2,10,10,2023-09-06T05:23:07,2023-09-06T17:23:25,0.7,"Rain, Partially cloudy",Partly cloudy throughout the day with late afternoon rain.,rain,"96937099999,96973099999,remote"
sumenep,9/7/2023,32.2,25.9,28.1,36.3,25.9,29.9,21.9,69.9,0.1,100,4.17,rain,0,0,29.5,24.8,138.1,1012.2,17.4,19.4,298.1,25.7,10,10,2023-09-07T05:22:36,2023-09-07T17:23:15,0.75,Rain,Clear conditions throughout the day with early morning rain.,rain,"96937099999,96973099999,remote"
sumenep,9/8/2023,30.5,25.9,27.8,34.5,25.9,29.2,21,67,0,0,0,rain,0,0,27,20.5,124.4,1012.3,51,19.2,293.1,25.2,10,10,2023-09-08T05:22:04,2023-09-08T17:23:06,0.77,Partially cloudy,Partly cloudy throughout the day.,partly-cloudy-day,"96937099999,96973099999,remote"
sumenep,9/9/2023,31.4,24.7,27.4,35.8,24.7,28.4,20.8,68.2,0,0,0,,0,0,29.5,27.7,115.8,1011.8,12.8,19.4,299.8,26,10,10,2023-09-09T05:21:32,2023-09-09T17:22:56,0.8,Clear,Clear conditions throughout the day.,clear-day,"96937099999,96973099999,remote"
sumenep,9/10/2023,31.3,25.3,27.7,34.6,25.3,29.3,21.7,70.1,0,0,0,,0,0,40.7,27.7,132.5,1012.1,18.5,19.5,298.7,25.9,10,10,2023-09-10T05:21:01,2023-09-10T17:22:47,0.84,Clear,Clear conditions throughout the day.,clear-day,"96937099999,96973099999,remote"
sumenep,9/11/2023,33.1,26.1,28.5,37.8,26.1,31,22.3,69.7,0,0,0,,0,0,30.6,22,128.4,1011.8,14.9,19.4,299.1,25.9,10,10,2023-09-11T05:20:28,2023-09-11T17:22:37,0.87,Clear,Clear conditions throughout the day.,clear-day,"96937099999,96973099999,remote"
sumenep,9/12/2023,31.5,26.5,28.4,36.5,26.5,31.2,22.8,72.5,0,0,0,,0,0,28.8,25.8,134.6,1012.5,21.1,19.4,295.3,25.5,10,10,2023-09-12T05:19:56,2023-09-12T17:22:27,0.9,Partially cloudy,Partly cloudy throughout the day.,partly-cloudy-day,"96937099999,96973099999,remote"
sumenep,9/13/2023,32.6,25.4,28.2,37.9,25.4,30.9,22.7,72.8,0,0,0,,0,0,32,29.5,123.1,1012.3,24.4,19.4,286.7,24.7,9,10,2023-09-13T05:19:24,2023-09-13T17:22:17,0.94,Partially cloudy,Clearing in the afternoon.,partly-cloudy-day,"96937099999,96973099999,remote"
sumenep,9/14/2023,31.1,26.7,27.9,35.9,26.7,30.3,22.2,71.1,0.1,100,4.17,rain,0,0,40,31.2,123.2,1012.7,20.3,20.1,286.5,24.6,10,10,2023-09-14T05:18:51,2023-09-14T17:22:07,0.97,"Rain, Partially cloudy",Partly cloudy throughout the day with morning rain.,rain,"96937099999,96973099999,remote"
sumenep,9/15/2023,32.2,25.9,28,36,25.9,29.9,21.3,67.2,0,0,0,,0,0,38.5,33.4,122.4,1012.4,13.1,19.4,296.9,25.6,10,10,2023-09-15T05:18:19,2023-09-15T17:21:57,0,Clear,Clear conditions throughout the day.,clear-day,"96937099999,96973099999,remote"
sumenep,9/16/2023,32.3,25.4,28,37.1,25.4,30.4,22.4,72.4,0,0,0,,0,0,36.7,22,115.1,1012.1,14.9,19.4,297.1,25.7,10,10,2023-09-16T05:17:46,2023-09-16T17:21:47,0.04,Clear,Clear conditions throughout the day.,clear-day,"96937099999,96973099999,remote"
sumenep,9/17/2023,31.1,26.3,28,36.2,26.3,30.5,22.8,73.9,0,0,0,,0,0,32,20.5,121.9,1011.3,37.6,19.4,290.5,25.1,10,10,2023-09-17T05:17:13,2023-09-17T17:21:37,0.07,Partially cloudy,Partly cloudy throughout the day.,partly-cloudy-day,"96937099999,96973099999,remote"
sumenep,9/18/2023,32.1,26.6,28.4,36.5,26.6,31,22.4,70.5,0.2,100,4.17,rain,0,0,26.6,28.3,134.4,1010.9,22.2,19.4,290.4,25.2,10,10,2023-09-18T05:16:41,2023-09-18T17:21:27,0.11,"Rain, Partially cloudy",Partly cloudy throughout the day with late afternoon rain.,rain,"96937099999,96973099999,remote"
sumenep,9/19/2023,32.7,25.7,28.3,36.8,25.7,30.4,21.9,69.2,0.2,100,4.17,rain,0,0,27.7,25.1,116.6,1011.2,23.5,20.1,299.2,25.7,10,10,2023-09-19T05:16:08,2023-09-19T17:21:17,0.14,"Rain, Partially cloudy",Partly cloudy throughout the day with early morning rain.,rain,"96937099999,96973099999,remote"
sumenep,9/20/2023,32.2,26.4,28.2,36.7,26.4,30.2,21.6,68.2,0,0,0,rain,0,0,30.6,23,118.5,1011.1,20.8,21.2,303.8,26,10,10,2023-09-20T05:15:35,2023-09-20T17:21:07,0.18,Partially cloudy,Partly cloudy throughout the day.,partly-cloudy-day,"96937099999,96973099999,remote"
sumenep,9/21/2023,32.4,26.1,27.9,37.4,26.1,29.8,21.4,68.4,0,0,0,rain,0,0,29.9,22.3,121.9,1011.3,5.8,19.1,307,26.5,10,10,2023-09-21T05:15:02,2023-09-21T17:20:57,0.21,Clear,Clear conditions throughout the day.,clear-day,"96937099999,96973099999,remote"
sumenep,9/22/2023,30.8,25.7,27.7,34.4,25.7,28.9,20.7,66.2,0,0,0,,0,0,26.6,18.4,137.9,1011.5,30,19.4,311.5,26.7,10,10,2023-09-22T05:14:30,2023-09-22T17:20:47,0.25,Partially cloudy,Partly cloudy throughout the day.,partly-cloudy-day,"96937099999,96973099999,remote"
sumenep,9/23/2023,32.9,25.7,28.1,36.4,25.7,29.7,21.5,68.1,0,0,0,,0,0,29.9,22.3,129.5,1011.3,52.8,19.4,307,26.5,10,10,2023-09-23T05:13:57,2023-09-23T17:20:37,0.25,Partially cloudy,Partly cloudy throughout the day.,partly-cloudy-day,"96937099999,96973099999,remote"
sumenep,9/24/2023,33.4,25.6,28.2,37.2,25.6,30.1,21.9,69.6,0,0,0,,0,0,34.6,30.9,122.5,1010.6,27.4,19.5,308.3,26.5,10,10,2023-09-24T05:13:24,2023-09-24T17:20:28,0.32,Partially cloudy,Partly cloudy throughout the day.,partly-cloudy-day,"96937099999,96973099999,remote"
sumenep,9/25/2023,33.2,25.9,28.5,37.9,25.9,30.5,22.1,69.6,0,0,0,,0,0,27.7,27.7,139.3,1011.1,25.6,19.4,306.8,26.4,10,10,2023-09-25T05:12:52,2023-09-25T17:20:18,0.35,Partially cloudy,Partly cloudy throughout the day.,partly-cloudy-day,"96937099999,96973099999,remote"
sumenep,9/26/2023,33,26.3,28.7,36.2,26.3,30.5,20.8,63.3,0,0,0,,0,0,32,22.3,125.1,1010.9,4.4,19.4,315.3,27.3,10,10,2023-09-26T05:12:20,2023-09-26T17:20:09,0.39,Clear,Clear conditions throughout the day.,clear-day,"96937099999,96973099999,remote"
sumenep,9/27/2023,32.7,26.1,28.3,35.7,26.1,30.4,21.8,68.8,0,0,0,,0,0,36.4,22.6,121.2,1011.5,23.1,19.4,310.6,26.6,10,10,2023-09-27T05:11:48,2023-09-27T17:20:00,0.42,Partially cloudy,Partly cloudy throughout the day.,partly-cloudy-day,"96937099999,96973099999,remote"
sumenep,9/28/2023,32.7,25.8,28.3,37.7,25.8,30.6,22.5,71.7,0,0,0,,0,0,34.9,33.5,115.1,1011.7,21.2,20.7,310.1,26.8,10,10,2023-09-28T05:11:16,2023-09-28T17:19:51,0.46,Partially cloudy,Partly cloudy throughout the day.,partly-cloudy-day,"96937099999,96973099999,remote"
sumenep,9/29/2023,33.1,26.6,28.4,38.8,26.6,31.7,23.2,74,0,0,0,,0,0,36,22,110.8,1012.6,27,19.4,311,26.7,10,10,2023-09-29T05:10:44,2023-09-29T17:19:43,0.5,Partially cloudy,Partly cloudy throughout the day.,partly-cloudy-day,"96937099999,96973099999,remote"
sumenep,9/30/2023,32.4,26.3,28.3,35.3,26.3,30.2,22.1,69.9,0,0,0,,0,0,27.7,16.6,121.6,1012.3,44.5,20,307.5,26.6,10,10,2023-09-30T05:10:12,2023-09-30T17:19:34,0.53,Partially cloudy,Partly cloudy throughout the day.,partly-cloudy-day,"96937099999,96973099999,remote"
sumenep,10/1/2023,32.6,25.3,28.3,37,25.3,30.3,22,69.7,0,0,0,,0,0,22,22.2,123.5,1012,29.9,19.4,311.7,27,10,10,2023-10-01T05:09:41,2023-10-01T17:19:26,0.56,Partially cloudy,Partly cloudy throughout the day.,partly-cloudy-day,"96937099999,96973099999,remote"
sumenep,10/2/2023,31.7,26.2,28.5,35.1,26.2,30.9,22.1,68.8,0,0,0,,0,0,27.4,21.9,125,1012.5,53.1,19.4,311.6,26.9,10,10,2023-10-02T05:09:10,2023-10-02T17:19:18,0.59,Partially cloudy,Partly cloudy throughout the day.,partly-cloudy-day,"96937099999,96973099999,remote"
sumenep,10/3/2023,32.9,25.4,28.6,37.9,25.4,31,22.2,69.4,0,0,0,,0,0,27.7,25.5,121.8,1013,61.8,19.4,314.8,27.1,10,10,2023-10-03T05:08:39,2023-10-03T17:19:10,0.62,Partially cloudy,Partly cloudy throughout the day.,partly-cloudy-day,"96937099999,96973099999,remote"
sumenep,10/4/2023,34.7,25.8,28.7,39.8,25.8,32.2,23.4,73.8,0,0,0,,0,0,32.8,19.1,108.8,1012.4,22.1,19.4,313.1,27,10,10,2023-10-04T05:08:09,2023-10-04T17:19:03,0.66,Partially cloudy,Partly cloudy throughout the day.,partly-cloudy-day,"96937099999,96973099999,remote"
sumenep,10/5/2023,32.7,26.7,28.9,39.9,26.7,33.1,24.1,76,0,0,0,,0,0,31.3,22.3,108.8,1011.5,16,19.4,307.2,26.4,10,30,2023-10-05T05:07:39,2023-10-05T17:18:56,0.69,Clear,Clear conditions throughout the day.,clear-day,"96937099999,96973099999,remote"
sumenep,10/6/2023,32.2,27,29.2,39.5,30.1,33,23.3,71.4,0,0,0,,0,0,33.5,19.8,114.3,1011.6,12.4,20.7,309.7,26.6,10,10,2023-10-06T05:07:09,2023-10-06T17:18:49,0.75,Clear,Clear conditions throughout the day.,clear-day,"96937099999,96973099999,remote"
sumenep,10/7/2023,33.7,27.4,29.1,39.9,30.9,33.4,23.9,74.1,0,0,0,,0,0,40,22.7,113.7,1011.5,25.8,19.4,296.5,25.4,10,30,2023-10-07T05:06:40,2023-10-07T17:18:43,0.75,Partially cloudy,Partly cloudy throughout the day.,partly-cloudy-day,"96937099999,96973099999,remote"
sumenep,10/8/2023,34.1,27.1,29.3,41.1,30,33.1,23.3,71,0,0,0,,0,0,45.7,37.1,113.7,1012.2,15,19.4,309.1,26.6,10,10,2023-10-08T05:06:11,2023-10-08T17:18:37,0.79,Clear,Clear conditions throughout the day.,clear-day,"96937099999,96973099999,remote"
sumenep,10/9/2023,33.3,26.9,29,39.9,29.7,33,23.6,73.1,0,0,0,,0,0,31.3,27.9,112.6,1012.4,9.1,19.4,315.8,27.2,10,10,2023-10-09T05:05:42,2023-10-09T17:18:32,0.82,Clear,Clear conditions throughout the day.,clear-day,"96937099999,96973099999,remote"
sumenep,10/10/2023,33,26.4,29,37.1,26.4,32.6,23.5,73.1,0,0,0,,0,0,24.5,15.5,111.2,1012,20.8,19.4,309.6,26.9,10,10,2023-10-10T05:05:14,2023-10-10T17:18:27,0.85,Partially cloudy,Partly cloudy throughout the day.,partly-cloudy-day,"96937099999,96973099999,remote"
sumenep,10/11/2023,32.2,27,29,39.5,29.8,32.8,23.2,71.5,0.2,100,8.33,rain,0,0,26.3,16.6,126.6,1011.6,21.9,19.4,299.7,26,10,10,2023-10-11T05:04:47,2023-10-11T17:18:22,0.88,"Rain, Partially cloudy",Partly cloudy throughout the day with early morning rain.,rain,"96937099999,96973099999,remote"
sumenep,10/12/2023,33.8,27.2,29.1,38.8,29.7,32.8,23.1,70.7,0,0,0,,0,0,36.4,20.5,116.7,1012.4,40.3,19.3,315,27,10,10,2023-10-12T05:04:20,2023-10-12T17:18:18,0.92,Partially cloudy,Partly cloudy throughout the day.,partly-cloudy-day,"96937099999,96973099999,remote"
sumenep,10/13/2023,33.2,27.2,29.1,40.3,30.1,33.4,23.8,73.5,0,0,0,,0,0,27.7,20.5,113.6,1012.3,44.1,20.1,299,25.8,10,10,2023-10-13T05:03:53,2023-10-13T17:18:14,0.95,Partially cloudy,Partly cloudy throughout the day.,partly-cloudy-day,"96937099999,96973099999,remote"
sumenep,10/14/2023,34.2,27.1,29.6,39.8,30.2,33.2,22.8,68.1,0,0,0,,0,0,38.5,25.2,117.5,1011.4,22.9,19.4,316.4,27.2,10,10,2023-10-14T05:03:27,2023-10-14T17:18:11,0.98,Partially cloudy,Partly cloudy throughout the day.,partly-cloudy-day,"96937099999,96973099999,remote"
sumenep,10/15/2023,34.1,27.4,29.6,41.4,31.2,33.6,23.1,69,0,0,0,,0,0,36,34.1,114.5,1011.4,38.4,19.4,304.4,26.4,10,10,2023-10-15T05:03:02,2023-10-15T17:18:08,0,Partially cloudy,Partly cloudy throughout the day.,partly-cloudy-day,"96937099999,96973099999,remote"
sumenep,10/16/2023,34.2,27.9,29.4,41.5,31.8,33.8,23.8,72.3,0,0,0,,0,0,36,22.3,115.7,1011.2,10,19.4,316.7,27.2,10,10,2023-10-16T05:02:37,2023-10-16T17:18:06,0.05,Clear,Clear conditions throughout the day.,clear-day,"96937099999,96973099999,remote"
sumenep,10/17/2023,34.4,26.2,29.3,40.6,26.2,33.2,23.4,71.5,0,0,0,,0,0,37.8,23.4,115.1,1011.7,41.2,19.4,320.9,27.7,10,10,2023-10-17T05:02:13,2023-10-17T17:18:05,0.09,Partially cloudy,Becoming cloudy in the afternoon.,partly-cloudy-day,"96937099999,96973099999,remote"
sumenep,10/18/2023,34.3,27.3,29.4,38.9,30.4,32.9,23,69.6,0,0,0,,0,0,32,23.5,112.4,1011.9,11.3,20,320.3,27.6,10,10,2023-10-18T05:01:49,2023-10-18T17:18:03,0.12,Clear,Clear conditions throughout the day.,clear-day,"96937099999,96973099999,remote"
sumenep,10/19/2023,34.3,27.6,29.5,39.9,30.7,33.1,22.9,68.7,0,0,0,,0,0,29.5,25.9,119.8,1012.2,31,19.4,314,27.1,10,10,2023-10-19T05:01:26,2023-10-19T17:18:03,0.16,Partially cloudy,Partly cloudy throughout the day.,partly-cloudy-day,"96937099999,96973099999,remote"
sumenep,10/20/2023,33.4,26.4,29.3,42.7,26.4,33.4,23.6,72.1,0,0,0,,0,0,28.4,20.5,105.3,1011.8,30.4,19.4,316.7,27.4,10,10,2023-10-20T05:01:04,2023-10-20T17:18:03,0.19,Partially cloudy,Clearing in the afternoon.,partly-cloudy-day,"96937099999,96973099999,remote"
sumenep,10/21/2023,33.2,25.8,29.2,38.7,25.8,33.1,23.8,74,0,0,0,,0,0,24.5,20.8,106.5,1011.9,53.3,19.4,315.4,27.4,10,30,2023-10-21T05:00:42,2023-10-21T17:18:04,0.23,Partially cloudy,Partly cloudy throughout the day.,partly-cloudy-day,"96937099999,96973099999,remote"
sumenep,10/22/2023,33.7,26.4,29.3,41,26.4,33.6,24.2,75.3,0,0,0,,0,0,22.7,23.7,109.7,1012.3,48.6,19.4,308.6,26.8,10,30,2023-10-22T05:00:21,2023-10-22T17:18:05,0.25,Partially cloudy,Partly cloudy throughout the day.,partly-cloudy-day,"96937099999,96973099999,remote"
sumenep,10/23/2023,33,27,29.1,39.1,30.1,33.3,24,74.9,0,0,0,,0,0,29.9,20.4,104.5,1011.9,44.3,19.4,312.6,27,10,30,2023-10-23T05:00:01,2023-10-23T17:18:07,0.3,Partially cloudy,Partly cloudy throughout the day.,partly-cloudy-day,"96937099999,96973099999,remote"
sumenep,10/24/2023,32.5,26.3,29.3,40.4,26.3,33.7,24.1,74.4,0.3,100,12.5,rain,0,0,25.6,35.3,115.2,1011.7,37.1,19.4,311,26.9,10,30,2023-10-24T04:59:41,2023-10-24T17:18:09,0.34,"Rain, Partially cloudy",Partly cloudy throughout the day with rain clearing later.,rain,"96937099999,96973099999,remote"
sumenep,10/25/2023,33.6,26.6,29.4,40.2,26.6,33.3,23.5,71.4,0,0,0,,0,0,26.3,22.7,105.8,1012.3,39.6,19.4,317.7,27.4,10,30,2023-10-25T04:59:23,2023-10-25T17:18:13,0.37,Partially cloudy,Clearing in the afternoon.,partly-cloudy-day,"96937099999,96973099999,remote"
sumenep,10/26/2023,33.7,26.9,29.8,41.1,30.2,34.2,23.8,71.4,0,0,0,,0,0,23.8,14.8,140.1,1011.9,11.9,19.4,388,33.4,10,30,2023-10-26T04:59:05,2023-10-26T17:18:17,0.41,Clear,Clear conditions throughout the day.,clear-day,"96937099999,96973099999,remote"
sumenep,10/27/2023,34.1,25.2,29.2,41.8,25.2,32.7,23.3,71.5,0,0,0,,0,0,30.2,31.7,113.1,1011.4,14.3,19.4,318.3,27.6,10,30,2023-10-27T04:58:48,2023-10-27T17:18:21,0.44,Clear,Clear conditions throughout the day.,clear-day,"96937099999,96973099999,remote"
sumenep,10/28/2023,33.8,26.2,29.6,41,26.2,33.7,23.5,70.4,0,0,0,,0,0,32.4,17.6,110.3,1010.8,7.8,19.4,323.4,27.8,10,10,2023-10-28T04:58:31,2023-10-28T17:18:26,0.48,Clear,Clear conditions throughout the day.,clear-day,"96937099999,96973099999,remote"
sumenep,10/29/2023,34.1,26.7,29.8,41,26.7,34.1,23.6,70.2,0,0,0,,0,0,27.7,31.7,111.1,1010.2,22.8,19.4,325.9,28.1,10,10,2023-10-29T04:58:16,2023-10-29T17:18:32,0.5,Partially cloudy,Partly cloudy throughout the day.,partly-cloudy-day,"96937099999,96973099999,remote"
sumenep,10/30/2023,33.7,26.7,29.6,42.8,26.7,34.1,23.8,71.9,0.3,100,12.5,rain,0,0,28.1,17.6,117.8,1009.8,28.7,19.4,303.3,26.3,10,10,2023-10-30T04:58:01,2023-10-30T17:18:39,0.54,"Rain, Partially cloudy",Partly cloudy throughout the day with early morning rain.,rain,"96937099999,96973099999,remote"
sumenep,10/31/2023,33.7,25.6,29.4,44,25.6,33.9,24,73.3,0,0,0,,0,0,31,27.7,117.4,1009.9,21.5,19.4,315.3,27.2,10,30,2023-10-31T04:57:48,2023-10-31T17:18:46,0.58,Partially cloudy,Partly cloudy throughout the day.,partly-cloudy-day,"96937099999,96973099999,remote"
sumenep,11/1/2023,32.9,27.7,29.9,40.2,31.2,34.8,24.1,71.7,0,0,0,,0,0,25.2,19.7,117.2,1010.5,72,19.3,308.4,26.7,10,30,2023-11-01T04:57:35,2023-11-01T17:18:54,0.61,Partially cloudy,Partly cloudy throughout the day.,partly-cloudy-day,"96937099999,96973099999,remote"
sumenep,11/2/2023,34.2,27.1,30,41.5,30.4,34.8,23.8,70.2,0,0,0,,0,0,30.6,18.4,114.9,1009.7,23.9,19.3,318.6,27.6,10,30,2023-11-02T04:57:23,2023-11-02T17:19:03,0.64,Partially cloudy,Partly cloudy throughout the day.,partly-cloudy-day,"96937099999,96973099999,remote"
sumenep,11/3/2023,33.1,28.2,29.9,41.7,32.2,35.5,24.6,73.8,0.2,100,4.17,rain,0,0,28.8,31.7,114.8,1009.3,53.6,18.6,284.7,24.6,9,30,2023-11-03T04:57:12,2023-11-03T17:19:12,0.67,"Rain, Partially cloudy",Partly cloudy throughout the day with late afternoon rain.,rain,"96937099999,96973099999,remote"
sumenep,11/4/2023,32,27.2,29.3,39.6,30.3,34.2,24.4,75.2,2,100,4.17,rain,0,0,27.7,16.9,109.2,1009.6,53.3,18.2,281.5,24.3,9,30,2023-11-04T04:57:02,2023-11-04T17:19:23,0.7,"Rain, Partially cloudy",Partly cloudy throughout the day with afternoon rain.,rain,"96937099999,96973099999,remote"
sumenep,11/5/2023,33.7,27.5,29.5,42.5,31.2,34.7,24.6,75.4,0.3,100,12.5,rain,0,0,24.8,18.4,100.2,1010,28.6,19.2,300.1,26,10,30,2023-11-05T04:56:52,2023-11-05T17:19:34,0.75,"Rain, Partially cloudy",Partly cloudy throughout the day with rain in the morning and afternoon.,rain,"96937099999,96973099999,remote"
sumenep,11/6/2023,33.6,27.2,29.8,41,30.7,34.7,24.3,73.1,0,0,0,,0,0,23,14.5,121.9,1010.2,51.5,19.4,320,27.6,10,30,2023-11-06T04:56:44,2023-11-06T17:19:45,0.77,Partially cloudy,Partly cloudy throughout the day.,partly-cloudy-day,"96937099999,96973099999,remote"
sumenep,11/7/2023,33.6,27.1,29.9,39.7,30.3,34.1,23.4,69,0,0,0,,0,0,19.8,15.9,121.1,1010.3,67.8,20,315.1,27.2,10,30,2023-11-07T04:56:37,2023-11-07T17:19:58,0.8,Partially cloudy,Partly cloudy throughout the day.,partly-cloudy-day,"96937099999,96973099999,remote"
sumenep,11/8/2023,33.9,27.3,30.3,40.7,30.6,34.8,23.6,68.5,0.2,100,4.17,rain,0,0,20.2,10.4,113.3,1009.5,18.1,19.4,318,27.4,10,30,2023-11-08T04:56:30,2023-11-08T17:20:11,0.83,Rain,Clear conditions throughout the day with late afternoon rain.,rain,"96937099999,96973099999,remote"
sumenep,11/9/2023,33.5,27.1,29.7,41.6,30.5,35.1,24.7,74.7,1.6,100,29.17,rain,0,0,21.6,11.2,311.9,1010.3,77.2,19.8,267.1,23.1,9,30,2023-11-09T04:56:25,2023-11-09T17:20:25,0.87,"Rain, Partially cloudy",Partly cloudy throughout the day with a chance of rain throughout the day.,rain,"96937099999,96973099999,remote"
sumenep,11/10/2023,35.1,27.5,29.9,44.5,31.3,35.1,24.4,73.1,1.1,100,37.5,rain,0,0,16.9,12.6,31.2,1010.8,80.2,19.9,285.3,24.6,10,30,2023-11-10T04:56:21,2023-11-10T17:20:39,0.9,"Rain, Partially cloudy",Partly cloudy throughout the day with rain.,rain,"96937099999,96973099999,remote"
sumenep,11/11/2023,33.4,27.6,30.1,41.7,31.5,35.2,24.3,71.8,0.7,100,20.83,rain,0,0,18,10.4,89.2,1011,50.2,19.1,296.7,25.4,9,30,2023-11-11T04:56:17,2023-11-11T17:20:55,0.93,"Rain, Partially cloudy",Partly cloudy throughout the day with rain clearing later.,rain,"96937099999,96973099999,remote"
sumenep,11/12/2023,34.1,27.4,30.4,41.6,31.3,35.2,23.8,68.8,0.4,100,16.67,rain,0,0,20.9,18.4,124.6,1011,33.1,19,303.8,26.2,10,30,2023-11-12T04:56:15,2023-11-12T17:21:11,0.96,"Rain, Partially cloudy",Partly cloudy throughout the day with early morning rain.,rain,"96937099999,96973099999,remote"
sumenep,11/13/2023,34.1,27.4,30.7,42.2,31.2,35.6,23.7,67.3,0.5,100,16.67,rain,0,0,20.2,15.5,129.2,1011,48.3,19.2,297.4,25.7,9,30,2023-11-13T04:56:13,2023-11-13T17:21:28,0,"Rain, Partially cloudy",Partly cloudy throughout the day with rain.,rain,"96937099999,96973099999,remote"
sumenep,11/14/2023,34.1,28.1,30.6,42.5,32.2,36.7,24.8,71.6,0.5,100,20.83,rain,0,0,26.6,24.8,119.9,1010.5,56.9,19.4,297.3,25.6,10,30,2023-11-14T04:56:13,2023-11-14T17:21:45,0.03,"Rain, Partially cloudy",Partly cloudy throughout the day with rain clearing later.,rain,"96937099999,96973099999,remote"
sumenep,11/15/2023,34.9,27.8,30.2,44,31.9,36.2,24.9,74,5,100,4.17,rain,0,0,19.8,24.1,153.7,1010.7,61.3,19.6,263.7,22.8,9,30,2023-11-15T04:56:14,2023-11-15T17:22:03,0.06,"Rain, Partially cloudy",Partly cloudy throughout the day with morning rain.,rain,"96937099999,96973099999,remote"
sumenep,11/16/2023,34.4,27.1,30.1,41.6,30.3,35.2,24.2,71.7,1.6,100,37.5,rain,0,0,20.5,20.5,184.4,1010.9,73.9,18.4,271.5,23.4,9,30,2023-11-16T04:56:15,2023-11-16T17:22:22,0.1,"Rain, Partially cloudy",Partly cloudy throughout the day with a chance of rain throughout the day.,rain,"96937099999,96973099999,remote"
sumenep,11/17/2023,33.1,27.2,29.5,41.6,30.5,34.8,24.7,75.7,1.6,100,33.33,rain,0,0,24.8,22.3,277,1011.1,68.5,16.6,257.3,22.3,8,30,2023-11-17T04:56:18,2023-11-17T17:22:42,0.14,"Rain, Partially cloudy",Partly cloudy throughout the day with a chance of rain throughout the day.,rain,"96937099999,96973099999,remote"
sumenep,11/18/2023,34.3,26.8,29.8,40.9,29.4,34.4,23.8,71.1,1.2,100,29.17,rain,0,0,22.3,16.6,255.3,1010.2,43.3,19.2,286.2,24.7,10,30,2023-11-18T04:56:21,2023-11-18T17:23:02,0.17,"Rain, Partially cloudy",Partly cloudy throughout the day with rain.,rain,"96937099999,96973099999,remote"
sumenep,11/19/2023,34.2,27.6,30.5,40.7,30.9,34.7,23,65.4,0.4,100,12.5,rain,0,0,20.9,21.9,161.8,1009.8,30.7,19.4,294.2,25.5,10,10,2023-11-19T04:56:26,2023-11-19T17:23:23,0.21,"Rain, Partially cloudy",Partly cloudy throughout the day with rain.,rain,"96937099999,96973099999,remote"
sumenep,11/20/2023,34.7,27.5,30.8,42,30.9,35.7,23.6,66.1,0.2,100,8.33,rain,0,0,25.9,17,144.5,1009.9,16.9,19.2,305.2,26.4,10,10,2023-11-20T04:56:31,2023-11-20T17:23:45,0.25,Rain,Clear conditions throughout the day with rain.,rain,"96937099999,96973099999,remote"
sumenep,11/21/2023,34.4,27.7,30.6,41.8,31.4,36,24.2,69.6,0.2,100,8.33,rain,0,0,32,19.4,124.6,1009.2,34.1,19.4,310.9,27,10,30,2023-11-21T04:56:38,2023-11-21T17:24:07,0.28,"Rain, Partially cloudy",Partly cloudy throughout the day with early morning rain.,rain,"96937099999,96973099999,remote"
sumenep,11/22/2023,35.5,28.4,30.8,44.4,33.1,36.7,24.5,69.6,0,0,0,,0,0,35.3,25.8,120.6,1008.2,76,19.4,306.6,26.4,10,30,2023-11-22T04:56:46,2023-11-22T17:24:30,0.31,Partially cloudy,Partly cloudy throughout the day.,partly-cloudy-day,"96937099999,96973099999,remote"
sumenep,11/23/2023,35.1,28.9,30.9,42.7,33.8,36.7,24.4,69.1,0.3,100,12.5,rain,0,0,25.9,14.4,114.3,1007.7,86.7,19.4,272.8,23.4,9,30,2023-11-23T04:56:54,2023-11-23T17:24:53,0.35,"Rain, Partially cloudy",Partly cloudy throughout the day with late afternoon rain.,rain,"96937099999,96973099999,remote"
sumenep,11/24/2023,32.9,27.1,29.5,41.4,30.4,35,24.9,76.9,3.8,100,58.33,rain,0,0,26.3,20.5,84.9,1008,88.3,18.7,250.1,21.6,8,30,2023-11-24T04:57:04,2023-11-24T17:25:17,0.39,"Rain, Partially cloudy",Partly cloudy throughout the day with a chance of rain throughout the day.,rain,"96937099999,96973099999,remote"
sumenep,11/25/2023,32,24.4,28.1,40.6,24.4,32,24.6,81.6,46,100,16.67,rain,0,0,20.2,36.8,172.3,1009,94.6,17.6,240.4,20.7,9,30,2023-11-25T04:57:14,2023-11-25T17:25:42,0.42,"Rain, Overcast",Cloudy skies throughout the day with rain.,rain,"96937099999,96973099999,remote"
sumenep,11/26/2023,32.7,25.5,28.8,41.7,25.5,32.9,24.4,78.1,1.6,100,33.33,rain,0,0,18,13,155,1008.7,86.3,17.8,259.5,22.3,9,30,2023-11-26T04:57:26,2023-11-26T17:26:07,0.46,"Rain, Partially cloudy",Partly cloudy throughout the day with rain.,rain,"96937099999,96973099999,remote"
sumenep,11/27/2023,30.6,26,28.2,37.2,26,31.9,24.6,81.5,1,100,4.17,rain,0,0,22,17.3,332.6,1008.7,82.2,18,234.6,20.3,7,10,2023-11-27T04:57:38,2023-11-27T17:26:33,0.5,"Rain, Partially cloudy",Partly cloudy throughout the day with afternoon rain.,rain,"96937099999,96973099999,remote"
sumenep,11/28/2023,30.3,25.1,27.2,37.6,25.1,29.8,24.6,86,57,100,8.33,rain,0,0,15.1,8.6,281.7,1009.3,98.7,16.9,155.3,13.5,6,30,2023-11-28T04:57:52,2023-11-28T17:26:59,0.53,"Rain, Overcast",Cloudy skies throughout the day with early morning rain.,rain,"96937099999,96973099999,remote"
sumenep,11/29/2023,31.7,26,28.3,37.4,26,32.5,24.9,82.1,5.1,100,62.5,rain,0,0,25.2,20.4,95.2,1008.8,88.1,18.4,231.1,19.9,8,30,2023-11-29T04:58:06,2023-11-29T17:27:26,0.56,"Rain, Partially cloudy",Partly cloudy throughout the day with a chance of rain throughout the day.,rain,"96937099999,96973099999,remote"
sumenep,11/30/2023,33.4,26.7,29,42.2,26.7,34.4,25.2,80.8,5.4,100,58.33,rain,0,0,24.5,27.3,117.1,1009,86.4,19.2,258.1,22.2,9,30,2023-11-30T04:58:21,2023-11-30T17:27:53,0.59,"Rain, Partially cloudy",Partly cloudy throughout the day with a chance of rain throughout the day.,rain,"96937099999,96973099999,remote"
sumenep,12/1/2023,31.6,25.7,27.5,39,25.7,30.4,25,86.4,27,100,12.5,rain,0,0,16.6,14.8,202.9,1009.1,95.9,13.5,208.3,18,7,30,2023-12-01T04:58:37,2023-12-01T17:28:21,0.62,"Rain, Overcast",Cloudy skies throughout the day with rain.,rain,"96937099999,96973099999,remote"
sumenep,12/2/2023,32.2,25.5,28.4,41.1,25.5,32.8,24.9,81.6,3.5,100,50,rain,0,0,27.4,18.4,126.7,1008.9,92.3,18.8,265.1,22.8,10,30,2023-12-02T04:58:54,2023-12-02T17:28:49,0.65,"Rain, Overcast",Cloudy skies throughout the day with a chance of rain throughout the day.,rain,"96937099999,96973099999,remote"
sumenep,12/3/2023,31.6,26.1,28.6,40.1,26.1,33.5,25,81.3,2,100,33.33,rain,0,0,24.5,13.7,105.6,1009.4,72.6,16.7,250.3,21.6,8,30,2023-12-03T04:59:12,2023-12-03T17:29:17,0.69,"Rain, Partially cloudy",Partly cloudy throughout the day with a chance of rain throughout the day.,rain,"96937099999,96973099999,remote"
sumenep,12/4/2023,32.7,26.7,28.5,40.6,26.7,33,24.7,80.3,4,100,4.17,rain,0,0,20.9,15.8,148.1,1010.1,89.2,17.2,195.7,16.8,8,30,2023-12-04T04:59:31,2023-12-04T17:29:46,0.72,"Rain, Partially cloudy",Partly cloudy throughout the day with morning rain.,rain,"96937099999,96973099999,remote"
sumenep,12/5/2023,34,26.6,29.1,42.5,26.6,33.8,24.7,77.7,1.2,100,20.83,rain,0,0,20.5,14,132.7,1009.5,59.8,19.2,284,24.6,10,30,2023-12-05T04:59:50,2023-12-05T17:30:15,0.75,"Rain, Partially cloudy",Partly cloudy throughout the day with a chance of rain throughout the day.,rain,"96937099999,96973099999,remote"
sumenep,12/6/2023,32.9,27,28.9,41,30.3,34.2,25.2,81.1,0.7,100,4.17,rain,0,0,18.4,15.5,246.8,1009.7,75.3,19,286.4,24.5,10,60,2023-12-06T05:00:10,2023-12-06T17:30:44,0.78,"Rain, Partially cloudy",Partly cloudy throughout the day with afternoon rain.,rain,"96937099999,96973099999,remote"
sumenep,12/7/2023,33.2,25.9,28.5,43.3,25.9,32.6,25.1,82.1,3.6,100,58.33,rain,0,0,25.6,15.5,284.5,1009.8,87.3,19.4,274.3,23.5,9,60,2023-12-07T05:00:31,2023-12-07T17:31:14,0.81,"Rain, Partially cloudy",Partly cloudy throughout the day with a chance of rain throughout the day.,rain,"96937099999,96973099999,remote"
sumenep,12/8/2023,31.9,26.1,28.5,40.5,26.1,32.5,24.9,81.4,6,100,4.17,rain,0,0,21.2,11.5,256.5,1009.5,82.5,17.2,255.5,22,9,60,2023-12-08T05:00:53,2023-12-08T17:31:44,0.85,"Rain, Partially cloudy",Partly cloudy throughout the day with morning rain.,rain,"96937099999,96973099999,remote"
sumenep,12/9/2023,31.5,26.6,28.3,39,26.6,32.9,25.2,83.8,4.2,100,54.17,rain,0,0,18.7,11.9,254.4,1009.2,86.3,18.6,212.2,18.5,7,60,2023-12-09T05:01:16,2023-12-09T17:32:14,0.88,"Rain, Partially cloudy",Partly cloudy throughout the day with a chance of rain throughout the day.,rain,"96937099999,96973099999,remote"
sumenep,12/10/2023,31.3,25.8,27.6,39.7,25.8,31.4,25,86,14,100,4.17,rain,0,0,23.8,22.2,326.6,1008.6,94.4,17.5,168,14.3,7,30,2023-12-10T05:01:39,2023-12-10T17:32:44,0.91,"Rain, Overcast",Cloudy skies throughout the day with afternoon rain.,rain,"96937099999,96973099999,remote"
sumenep,12/11/2023,32.8,26,28.9,41.4,26,33.7,24.8,78.7,0.8,100,25,rain,0,0,16.2,15.8,329.7,1008.1,70.1,19.2,226.3,19.6,7,60,2023-12-11T05:02:03,2023-12-11T17:33:14,0.94,"Rain, Partially cloudy",Partly cloudy throughout the day with rain.,rain,"96937099999,96973099999,remote"
sumenep,12/12/2023,33.9,26.3,29,41.5,26.3,33.8,24.8,78.5,1.2,100,37.5,rain,0,0,18.4,12.6,325.6,1008.1,32.9,20.2,275.4,23.8,9,30,2023-12-12T05:02:28,2023-12-12T17:33:45,0.98,"Rain, Partially cloudy",Partly cloudy throughout the day with a chance of rain throughout the day.,rain,"96937099999,96973099999,remote"
sumenep,12/13/2023,30.7,26.9,28.4,38.7,30.4,33.7,25.4,84,6.5,100,8.33,rain,0,0,19.1,12.6,337.5,1009,74.6,17.5,253.6,22,9,30,2023-12-13T05:02:53,2023-12-13T17:34:16,0,"Rain, Partially cloudy",Partly cloudy throughout the day with afternoon rain.,rain,"96937099999,96973099999,remote"
sumenep,12/14/2023,33.1,26.3,28.3,44,26.3,32.4,25.2,84,0.6,100,4.17,rain,0,0,16.9,20.5,233.7,1009.8,90.9,18.4,218.5,18.9,8,30,2023-12-14T05:03:19,2023-12-14T17:34:46,0.04,"Rain, Overcast",Cloudy skies throughout the day with afternoon rain.,rain,"96937099999,96973099999,remote"
sumenep,12/15/2023,32.1,26.1,28,39.8,26.1,32.1,24.9,83.6,2,100,4.17,rain,0,0,25.9,14.4,315,1009.5,81.3,17.6,215.4,18.5,7,30,2023-12-15T05:03:45,2023-12-15T17:35:17,0.08,"Rain, Partially cloudy",Partly cloudy throughout the day with afternoon rain.,rain,"96937099999,96973099999,remote"
sumenep,12/16/2023,33.1,26.2,28.8,40,26.2,33.4,25,80.9,2.3,100,45.83,rain,0,0,20.5,9.7,265.4,1009.1,76.8,18.4,262.6,22.6,9,30,2023-12-16T05:04:12,2023-12-16T17:35:47,0.11,"Rain, Partially cloudy",Partly cloudy throughout the day with a chance of rain throughout the day.,rain,"96937099999,96973099999,remote"
sumenep,12/17/2023,33.6,26.6,29,42.1,26.6,33.8,24.8,79,1.5,100,37.5,rain,0,0,20.5,20.5,160.8,1009.5,71.7,17.8,264.9,23,9,30,2023-12-17T05:04:39,2023-12-17T17:36:18,0.15,"Rain, Partially cloudy",Partly cloudy throughout the day with a chance of rain throughout the day.,rain,"96937099999,96973099999,remote"
sumenep,12/18/2023,32.9,26.4,29.2,40.5,26.4,33.6,24.3,75.1,0.5,100,20.83,rain,0,0,15.1,18.6,142,1009.7,83.1,19.3,277.9,24,9,10,2023-12-18T05:05:07,2023-12-18T17:36:49,0.19,"Rain, Partially cloudy",Partly cloudy throughout the day with a chance of rain throughout the day.,rain,"96937099999,96973099999,remote"
sumenep,12/19/2023,33.2,26.8,29.4,38.9,29.2,33.2,23.2,70.2,0.5,100,16.67,rain,0,0,19.8,10.4,209.9,1009.8,54.7,19.5,257.1,22.2,9,10,2023-12-19T05:05:36,2023-12-19T17:37:19,0.22,"Rain, Partially cloudy",Partly cloudy throughout the day with rain.,rain,"96937099999,96973099999,remote"
sumenep,12/20/2023,33.8,26.4,29.4,39.3,26.4,32.7,22.7,67.9,0.5,100,20.83,rain,0,0,17.3,18.4,186.5,1009.5,44.7,19.4,289.6,25.1,9,10,2023-12-20T05:06:04,2023-12-20T17:37:49,0.25,"Rain, Partially cloudy",Partly cloudy throughout the day with a chance of rain throughout the day.,rain,"96937099999,96973099999,remote"
sumenep,12/21/2023,32.7,26.3,29.2,40,26.3,33.4,23.6,72.2,15,100,4.17,rain,0,0,15.5,12.2,104.6,1010,49.9,19.3,294.4,25.5,10,10,2023-12-21T05:06:34,2023-12-21T17:38:19,0.29,"Rain, Partially cloudy",Partly cloudy throughout the day with afternoon rain.,rain,"96937099999,96973099999,remote"
sumenep,12/22/2023,33.7,26.7,29.4,43.2,29.9,34.5,24.4,75,1.2,100,37.5,rain,0,0,15.8,14.8,139.8,1010.6,63.7,19.3,278.4,24.2,9,30,2023-12-22T05:07:03,2023-12-22T17:38:49,0.33,"Rain, Partially cloudy",Partly cloudy throughout the day with a chance of rain throughout the day.,rain,"96937099999,96973099999,remote"
sumenep,12/23/2023,34.1,27.4,30.1,43.4,30.8,34.7,23.8,70,0.3,100,8.33,rain,0,0,19.1,11.2,128.4,1011.2,55.6,19.2,308.2,26.7,10,30,2023-12-23T05:07:33,2023-12-23T17:39:18,0.36,"Rain, Partially cloudy",Partly cloudy throughout the day with late afternoon rain.,rain,"96937099999,96973099999,remote"
sumenep,12/24/2023,34.4,26.5,30,43.8,26.5,34.9,24.1,71.5,0.4,100,16.67,rain,0,0,17.3,20.5,107.4,1010.8,74.1,18.5,295,25.5,9,30,2023-12-24T05:08:03,2023-12-24T17:39:48,0.4,"Rain, Partially cloudy",Partly cloudy throughout the day with rain.,rain,"96937099999,96973099999,remote"
sumenep,12/25/2023,32.1,26.8,28.5,40.6,30.2,32.8,24.5,79.3,9,100,8.33,rain,0,0,24.8,14,302.4,1011.4,88.4,17,251.5,21.7,9,30,2023-12-25T05:08:34,2023-12-25T17:40:17,0.44,"Rain, Partially cloudy",Partly cloudy throughout the day with rain.,rain,"96937099999,96973099999,remote"
